4招让"大姨妈"不再刁难你|data/4招让"大姨妈"不再刁难你|0|0|1346749072|1346749072|16
八招预防女性更年期综合症|data/八招预防女性更年期综合症|0|0|1346749072|1346749072|16
女人月经出现这些状况很可怕|data/女人月经出现这些状况很可怕|0|0|1346749072|1346749072|16
女性须知 夏季常吹空调容易痛经|data/女性须知 夏季常吹空调容易痛经|0|0|1346749072|1346749072|16
如何确诊多囊卵巢综合症|data/如何确诊多囊卵巢综合症|0|0|1346749072|1346749072|16
教你如何摆脱更年期四大症状|data/教你如何摆脱更年期四大症状|0|0|1346749072|1346749072|16
有些女人为什么痛经？|data/有些女人为什么痛经？|0|0|1346749072|1346749072|16
治愈十大经期“怪病”小妙招|data/治愈十大经期“怪病”小妙招|0|0|1346749072|1346749072|16
缓解各种类型的痛经方法|data/缓解各种类型的痛经方法|0|0|1346749072|1346749072|16
闭经的症状有哪些 早发现早治疗|data/闭经的症状有哪些 早发现早治疗|0|0|1346749072|1346749072|16
