不可忽略的性生活性爱后戏|data/不可忽略的性生活性爱后戏|0|0|1346749070|1346749070|25
做爱后四件事万不能做|data/做爱后四件事万不能做|0|0|1346749070|1346749070|25
做爱后如何注意卫生问题?|data/做爱后如何注意卫生问题?|0|0|1346749070|1346749070|25
做爱高潮后需做的缠绵事|data/做爱高潮后需做的缠绵事|0|0|1346749070|1346749070|25
夫妻做爱时间可以遵循2∶3∶2的原则(前戏、性交和后戏)|data/夫妻做爱时间可以遵循2∶3∶2的原则(前戏、性交和后戏)|0|0|1346749070|1346749070|25
射精后 还有多少善后工作要做?|data/射精后 还有多少善后工作要做?|0|0|1346749070|1346749070|25
性爱后不可马马虎虎结束|data/性爱后不可马马虎虎结束|0|0|1346749070|1346749070|25
性爱后男人怎样做后戏?|data/性爱后男人怎样做后戏?|0|0|1346749070|1346749070|25
性生活后需要避冷|data/性生活后需要避冷|0|0|1346749070|1346749070|25
男人性爱后科学的恢复精力|data/男人性爱后科学的恢复精力|0|0|1346749070|1346749070|25
让你性高潮之后有所不同的四密招|data/让你性高潮之后有所不同的四密招|0|0|1346749070|1346749070|25
