11种错误的避孕观念|data/11种错误的避孕观念|0|0|1346749072|1346749072|10
4种最容易搞出“人命”的避孕方法|data/4种最容易搞出“人命”的避孕方法|0|0|1346749072|1346749072|10
一名妇科医生的避孕经验|data/一名妇科医生的避孕经验|0|0|1346749072|1346749072|10
不会避孕的男人不配爱|data/不会避孕的男人不配爱|0|0|1346749072|1346749072|10
不同薄厚安全套各有功效|data/不同薄厚安全套各有功效|0|0|1346749072|1346749072|10
不宜选用“安全期避孕”的女人|data/不宜选用“安全期避孕”的女人|0|0|1346749072|1346749072|10
不影响性交快感的避孕技巧|data/不影响性交快感的避孕技巧|0|0|1346749072|1346749072|10
五花八门的避孕方法哪种最安全?|data/五花八门的避孕方法哪种最安全?|0|0|1346749072|1346749072|10
产后性生活可以不避孕吗？|data/产后性生活可以不避孕吗？|0|0|1346749072|1346749072|10
人流后女性常见健康问题 对症解决|data/人流后女性常见健康问题 对症解决|0|0|1346749072|1346749072|10
人流好还是药流好？|data/人流好还是药流好？|0|0|1346749072|1346749072|10
人类安全套360年的演变|data/人类安全套360年的演变|0|0|1346749072|1346749072|10
什么样的性交姿势最不容易受孕?|data/什么样的性交姿势最不容易受孕?|0|0|1346749072|1346749072|10
体外射精带来的“后遗症”|data/体外射精带来的“后遗症”|0|0|1346749072|1346749072|10
你知道避孕套的神奇妙用吗?|data/你知道避孕套的神奇妙用吗?|0|0|1346749072|1346749072|10
使用安全套时细节不容忽视|data/使用安全套时细节不容忽视|0|0|1346749072|1346749072|10
具有避孕效果的几种食物|data/具有避孕效果的几种食物|0|0|1346749072|1346749072|10
初为人母13类避孕方法各不同|data/初为人母13类避孕方法各不同|0|0|1346749072|1346749072|10
十种情况不可服避孕药|data/十种情况不可服避孕药|0|0|1346749072|1346749072|10
吃避孕药5种常见不良反应及解决办法|data/吃避孕药5种常见不良反应及解决办法|0|0|1346749072|1346749072|10
吃避孕药会变胖吗？|data/吃避孕药会变胖吗？|0|0|1346749072|1346749072|10
吃避孕药出现不良反应 小技巧缓解不适|data/吃避孕药出现不良反应 小技巧缓解不适|0|0|1346749072|1346749072|10
吃避孕药同时要补什么？|data/吃避孕药同时要补什么？|0|0|1346749072|1346749072|10
哪些姿势让你次次怀孕?|data/哪些姿势让你次次怀孕?|0|0|1346749072|1346749072|10
哪些技巧会让安全套更安全?|data/哪些技巧会让安全套更安全?|0|0|1346749072|1346749072|10
哪些避孕措施会影响性功能?|data/哪些避孕措施会影响性功能?|0|0|1346749072|1346749072|10
外用避孕药的注意事项|data/外用避孕药的注意事项|0|0|1346749072|1346749072|10
女人最喜欢用什么方法避孕?|data/女人最喜欢用什么方法避孕?|0|0|1346749072|1346749072|10
女性吃紧急避孕药要注意什么?|data/女性吃紧急避孕药要注意什么?|0|0|1346749072|1346749072|10
女性生理安全期该怎么计算?|data/女性生理安全期该怎么计算?|0|0|1346749072|1346749072|10
女性绝对的安全期是哪几天？|data/女性绝对的安全期是哪几天？|0|0|1346749072|1346749072|10
女性须知的一些避孕常识|data/女性须知的一些避孕常识|0|0|1346749072|1346749072|10
女性，安全期及避孕、受孕全攻略|data/女性，安全期及避孕、受孕全攻略|0|0|1346749072|1346749072|10
女用避孕套有何优点?|data/女用避孕套有何优点?|0|0|1346749072|1346749072|10
如何判断该选择何种流产方式?|data/如何判断该选择何种流产方式?|0|0|1346749072|1346749072|10
如何正确安全地使用套套?|data/如何正确安全地使用套套?|0|0|1346749072|1346749072|10
如何选择最合适的避孕药?|data/如何选择最合适的避孕药?|0|0|1346749072|1346749072|10
如何选购合适的避孕套?|data/如何选购合适的避孕套?|0|0|1346749072|1346749072|10
妇科专家提醒女性月经期也可能怀孕|data/妇科专家提醒女性月经期也可能怀孕|0|0|1346749072|1346749072|10
安全套知识你了解多少?|data/安全套知识你了解多少?|0|0|1346749072|1346749072|10
怀孕了如何性爱指南?|data/怀孕了如何性爱指南?|0|0|1346749072|1346749072|10
愚蠢避孕可导致性功能障碍|data/愚蠢避孕可导致性功能障碍|0|0|1346749072|1346749072|10
教你推算安全期和排卵期|data/教你推算安全期和排卵期|0|0|1346749072|1346749072|10
无痛人流的最佳时间是什么时候?|data/无痛人流的最佳时间是什么时候?|0|0|1346749072|1346749072|10
未婚女性最佳避孕方式全攻略|data/未婚女性最佳避孕方式全攻略|0|0|1346749072|1346749072|10
正确使用避孕套避孕4个方法|data/正确使用避孕套避孕4个方法|0|0|1346749072|1346749072|10
每个女人的安全期都不同|data/每个女人的安全期都不同|0|0|1346749072|1346749072|10
比较容易避孕的性爱姿势|data/比较容易避孕的性爱姿势|0|0|1346749072|1346749072|10
男性常用的避孕方法有哪些?|data/男性常用的避孕方法有哪些?|0|0|1346749072|1346749072|10
男性避孕套的正确使用方法|data/男性避孕套的正确使用方法|0|0|1346749072|1346749072|10
男性避孕药物有哪些?|data/男性避孕药物有哪些?|0|0|1346749072|1346749072|10
科学使用避孕套16个细节|data/科学使用避孕套16个细节|0|0|1346749072|1346749072|10
科学避孕，方法多多|data/科学避孕，方法多多|0|0|1346749072|1346749072|10
第一次性爱学会如何避孕|data/第一次性爱学会如何避孕|0|0|1346749072|1346749072|10
紧急避孕须注意七件事|data/紧急避孕须注意七件事|0|0|1346749072|1346749072|10
给吃避孕药避孕的女性推荐的食谱|data/给吃避孕药避孕的女性推荐的食谱|0|0|1346749072|1346749072|10
草莓、巧克力味的安全套不能用|data/草莓、巧克力味的安全套不能用|0|0|1346749072|1346749072|10
超薄安全套不是每个男人都适用|data/超薄安全套不是每个男人都适用|0|0|1346749072|1346749072|10
近六成人用错安全套|data/近六成人用错安全套|0|0|1346749072|1346749072|10
避孕后发生怀孕怎么办?|data/避孕后发生怀孕怎么办?|0|0|1346749072|1346749072|10
避孕套功效与薄厚程度有关|data/避孕套功效与薄厚程度有关|0|0|1346749072|1346749072|10
避孕套破了怎么办?|data/避孕套破了怎么办?|0|0|1346749072|1346749072|10
避孕套要怎么选怎么用才最安全?|data/避孕套要怎么选怎么用才最安全?|0|0|1346749072|1346749072|10
避孕药7个常见疑问|data/避孕药7个常见疑问|0|0|1346749072|1346749072|10
避孕药一个月最多不要超过几次?|data/避孕药一个月最多不要超过几次?|0|0|1346749072|1346749072|10
避孕药十大妙用与经痛说拜拜|data/避孕药十大妙用与经痛说拜拜|0|0|1346749072|1346749072|10
阴道冲洗能够避孕和防性病吗？|data/阴道冲洗能够避孕和防性病吗？|0|0|1346749072|1346749072|10
