A点、F区、R区、G点、U点，不懂的，一定要看！|data/A点、F区、R区、G点、U点，不懂的，一定要看！|0|0|1346749073|1346749073|9
为什么有的女子会发生闭经?|data/为什么有的女子会发生闭经?|0|0|1346749073|1346749073|9
乳房与性欲的因果联系|data/乳房与性欲的因果联系|0|0|1346749073|1346749073|9
乳房的内部结构|data/乳房的内部结构|0|0|1346749073|1346749073|9
什么是“石女”?|data/什么是“石女”?|0|0|1346749073|1346749073|9
关于女性性高潮的5个事实|data/关于女性性高潮的5个事实|0|0|1346749073|1346749073|9
关于阴道前庭|data/关于阴道前庭|0|0|1346749073|1346749073|9
判断前戏效果的四窍门|data/判断前戏效果的四窍门|0|0|1346749073|1346749073|9
告诉你真实的处女膜|data/告诉你真实的处女膜|0|0|1346749073|1346749073|9
处女膜能说明些什么?|data/处女膜能说明些什么?|0|0|1346749073|1346749073|9
女人20 30 40之性爱频率|data/女人20 30 40之性爱频率|0|0|1346749073|1346749073|9
女人一生的4个情欲高峰期|data/女人一生的4个情欲高峰期|0|0|1346749073|1346749073|9
女人对性的基本需求类型|data/女人对性的基本需求类型|0|0|1346749073|1346749073|9
女人性爱中哪个部位最敏感?|data/女人性爱中哪个部位最敏感?|0|0|1346749073|1346749073|9
女人期待男人爱抚的12个兴奋点|data/女人期待男人爱抚的12个兴奋点|0|0|1346749073|1346749073|9
女人私处的毛发到底有什么用?|data/女人私处的毛发到底有什么用?|0|0|1346749073|1346749073|9
女人私处的生理参数|data/女人私处的生理参数|0|0|1346749073|1346749073|9
女人阴道的8个秘密|data/女人阴道的8个秘密|0|0|1346749073|1346749073|9
女性乳房的性生理反应|data/女性乳房的性生理反应|0|0|1346749073|1346749073|9
女性处女膜到底在哪里？|data/女性处女膜到底在哪里？|0|0|1346749073|1346749073|9
女性床上性高潮时六种表现|data/女性床上性高潮时六种表现|0|0|1346749073|1346749073|9
女性性器官标准数据|data/女性性器官标准数据|0|0|1346749073|1346749073|9
女性的卵巢有什么用?|data/女性的卵巢有什么用?|0|0|1346749073|1346749073|9
女性阴道标准尺寸是多少?|data/女性阴道标准尺寸是多少?|0|0|1346749073|1346749073|9
女性阴部阴毛的特征|data/女性阴部阴毛的特征|0|0|1346749073|1346749073|9
女生在何时乳房丰满度最佳?|data/女生在何时乳房丰满度最佳?|0|0|1346749073|1346749073|9
如何得知处女膜是否破裂?|data/如何得知处女膜是否破裂?|0|0|1346749073|1346749073|9
引起女人射精的G点|data/引起女人射精的G点|0|0|1346749073|1346749073|9
性交中的阴蒂作用|data/性交中的阴蒂作用|0|0|1346749073|1346749073|9
性兴奋时女人的生理变化|data/性兴奋时女人的生理变化|0|0|1346749073|1346749073|9
性反应的标志-阴道液|data/性反应的标志-阴道液|0|0|1346749073|1346749073|9
性爱呻吟是生理反应吗?|data/性爱呻吟是生理反应吗?|0|0|1346749073|1346749073|9
性生活时乳房为何会硬?|data/性生活时乳房为何会硬?|0|0|1346749073|1346749073|9
性生活时女人的生理变化解析|data/性生活时女人的生理变化解析|0|0|1346749073|1346749073|9
性红晕 女人性高潮征兆|data/性红晕 女人性高潮征兆|0|0|1346749073|1346749073|9
教你认识月经|data/教你认识月经|0|0|1346749073|1346749073|9
月经周期的奥秘|data/月经周期的奥秘|0|0|1346749073|1346749073|9
生理常识-小阴唇是什么?|data/生理常识-小阴唇是什么?|0|0|1346749073|1346749073|9
细说女性外阴|data/细说女性外阴|0|0|1346749073|1346749073|9
阴唇乌黑的原因|data/阴唇乌黑的原因|0|0|1346749073|1346749073|9
阴唇在性反应中的不同变化|data/阴唇在性反应中的不同变化|0|0|1346749073|1346749073|9
阴毛与性欲有无关系|data/阴毛与性欲有无关系|0|0|1346749073|1346749073|9
阴道在性反应周期中的变化|data/阴道在性反应周期中的变化|0|0|1346749073|1346749073|9
阴道的小秘密|data/阴道的小秘密|0|0|1346749073|1346749073|9
阴道的结构及生理特点|data/阴道的结构及生理特点|0|0|1346749073|1346749073|9
阴道里面是怎么样的?|data/阴道里面是怎么样的?|0|0|1346749073|1346749073|9
女人高潮有哪些生理反应?|data/女人高潮有哪些生理反应?|0|0|1347445447|1347445447|9
男人必看：揭露女人高潮时的“爱液”|data/男人必看：揭露女人高潮时的“爱液”|0|0|1347445546|1347445546|9
