挣扎or梦幻 让男人流鼻血的10个脱衣姿势|data/挣扎or梦幻 让男人流鼻血的10个脱衣姿势|0|0|1346749071|1346749071|18
模范夫妻推荐几款性爱游戏|data/模范夫妻推荐几款性爱游戏|0|0|1346749071|1346749071|18
激起欲望的十二招催情法|data/激起欲望的十二招催情法|0|0|1346749071|1346749071|18
男人为之疯狂的8个调情小技巧|data/男人为之疯狂的8个调情小技巧|0|0|1346749071|1346749071|18
男女管用的性暗示调情技巧|data/男女管用的性暗示调情技巧|0|0|1346749071|1346749071|18
看电影学12种调情技巧|data/看电影学12种调情技巧|0|0|1346749071|1346749071|18
给女人脱衣服时的技巧|data/给女人脱衣服时的技巧|0|0|1346749071|1346749071|18
让处女和你上床的10句话|data/让处女和你上床的10句话|0|0|1346749071|1346749071|18
让性生活始终保持激情的床上小游戏|data/让性生活始终保持激情的床上小游戏|0|0|1346749071|1346749071|18
让男人拜倒在石榴裙底下的9个姿势|data/让男人拜倒在石榴裙底下的9个姿势|0|0|1346749071|1346749071|18
调情秘籍：用内裤来勾引他|data/调情秘籍：用内裤来勾引他|0|0|1346749071|1346749071|18
隔靴搔痒 探入式调情|data/隔靴搔痒 探入式调情|0|0|1346749071|1346749071|18
19种让女人颤抖的口交姿势|data/19种让女人颤抖的口交姿势|0|0|1346749071|1346749071|24
MM怎样使他的阴茎坚硬无比?|data/MM怎样使他的阴茎坚硬无比?|0|0|1346749071|1346749071|24
丈夫怎么喜欢肛交?|data/丈夫怎么喜欢肛交?|0|0|1346749071|1346749071|24
乳交-让你魂断痴迷的做爱方法|data/乳交-让你魂断痴迷的做爱方法|0|0|1346749071|1346749071|24
乳交基本方法|data/乳交基本方法|0|0|1346749071|1346749071|24
出色口交俘虏芳心|data/出色口交俘虏芳心|0|0|1346749071|1346749071|24
口交的五秘诀-女士必看|data/口交的五秘诀-女士必看|0|0|1346749071|1346749071|24
品桃吹萧要有技巧|data/品桃吹萧要有技巧|0|0|1346749071|1346749071|24
唇手齐用 给他热血贲涨的刺激|data/唇手齐用 给他热血贲涨的刺激|0|0|1346749071|1346749071|24
女人必备的口交技巧|data/女人必备的口交技巧|0|0|1346749071|1346749071|24
女性口交的三个层次|data/女性口交的三个层次|0|0|1346749071|1346749071|24
烙印于心的极限性快感|data/烙印于心的极限性快感|0|0|1346749071|1346749071|24
男人如何为她口交的性技巧指引?|data/男人如何为她口交的性技巧指引?|0|0|1346749071|1346749071|24
白领说自己给男人的口交的经历与技巧|data/白领说自己给男人的口交的经历与技巧|0|0|1346749071|1346749071|24
肛交有什么好处和坏处 如何进行肛交?|data/肛交有什么好处和坏处 如何进行肛交?|0|0|1346749071|1346749071|24
舔女性阴部的详细步骤技巧|data/舔女性阴部的详细步骤技巧|0|0|1346749071|1346749071|24
让女友乐意为自己口交的秘诀技巧|data/让女友乐意为自己口交的秘诀技巧|0|0|1346749071|1346749071|24
让女友都喜欢的肛交技巧|data/让女友都喜欢的肛交技巧|0|0|1346749071|1346749071|24
不可忽略的性生活性爱后戏|data/不可忽略的性生活性爱后戏|0|0|1346749070|1346749070|25
做爱后四件事万不能做|data/做爱后四件事万不能做|0|0|1346749070|1346749070|25
做爱后如何注意卫生问题?|data/做爱后如何注意卫生问题?|0|0|1346749070|1346749070|25
做爱高潮后需做的缠绵事|data/做爱高潮后需做的缠绵事|0|0|1346749070|1346749070|25
夫妻做爱时间可以遵循2∶3∶2的原则(前戏、性交和后戏)|data/夫妻做爱时间可以遵循2∶3∶2的原则(前戏、性交和后戏)|0|0|1346749070|1346749070|25
射精后 还有多少善后工作要做?|data/射精后 还有多少善后工作要做?|0|0|1346749070|1346749070|25
性爱后不可马马虎虎结束|data/性爱后不可马马虎虎结束|0|0|1346749070|1346749070|25
性爱后男人怎样做后戏?|data/性爱后男人怎样做后戏?|0|0|1346749070|1346749070|25
性生活后需要避冷|data/性生活后需要避冷|0|0|1346749070|1346749070|25
男人性爱后科学的恢复精力|data/男人性爱后科学的恢复精力|0|0|1346749070|1346749070|25
让你性高潮之后有所不同的四密招|data/让你性高潮之后有所不同的四密招|0|0|1346749070|1346749070|25
6个简单又好用的性爱提升性技巧|data/6个简单又好用的性爱提升性技巧|0|0|1346749072|1346749072|17
6绝招让你的女人性福|data/6绝招让你的女人性福|0|0|1346749072|1346749072|17
7种野战场地需要注意的事项|data/7种野战场地需要注意的事项|0|0|1346749072|1346749072|17
“九浅一深”性交运动新变化|data/“九浅一深”性交运动新变化|0|0|1346749072|1346749072|17
一时性起，野炮初体验|data/一时性起，野炮初体验|0|0|1346749072|1346749072|17
不可思议八大性爱“野战”地点|data/不可思议八大性爱“野战”地点|0|0|1346749072|1346749072|17
两性兵法：最甜蜜的7种嘿咻类型|data/两性兵法：最甜蜜的7种嘿咻类型|0|0|1346749072|1346749072|17
九性爱秘诀让你越来越性福|data/九性爱秘诀让你越来越性福|0|0|1346749072|1346749072|17
伟哥使用说明|data/伟哥使用说明|0|0|1346749072|1346749072|17
值得学习的性爱12奇招|data/值得学习的性爱12奇招|0|0|1346749072|1346749072|17
全天7个时段的完美性爱方案|data/全天7个时段的完美性爱方案|0|0|1346749072|1346749072|17
关于四种基本的性交形式|data/关于四种基本的性交形式|0|0|1346749072|1346749072|17
哪些情况下不宜性交?|data/哪些情况下不宜性交?|0|0|1346749072|1346749072|17
在车内做爱的技巧(以宝马为例)|data/在车内做爱的技巧(以宝马为例)|0|0|1346749072|1346749072|17
增加性爱情趣的十招|data/增加性爱情趣的十招|0|0|1346749072|1346749072|17
夫妻情侣野战技巧以及要注意的问题|data/夫妻情侣野战技巧以及要注意的问题|0|0|1346749072|1346749072|17
女人们让男人臣服的性技巧|data/女人们让男人臣服的性技巧|0|0|1346749072|1346749072|17
女人如何回应男人的抚慰?|data/女人如何回应男人的抚慰?|0|0|1346749072|1346749072|17
女人最爱的性爱房事技巧男人需懂|data/女人最爱的性爱房事技巧男人需懂|0|0|1346749072|1346749072|17
女人都受不了的高潮技巧|data/女人都受不了的高潮技巧|0|0|1346749072|1346749072|17
女性最爱的4大交欢场所|data/女性最爱的4大交欢场所|0|0|1346749072|1346749072|17
巧用镜子令性爱更狂野|data/巧用镜子令性爱更狂野|0|0|1346749072|1346749072|17
床上聊什么最“助性”：多夸赞少牢骚|data/床上聊什么最“助性”：多夸赞少牢骚|0|0|1346749072|1346749072|17
弄清女性生理周期再做爱|data/弄清女性生理周期再做爱|0|0|1346749072|1346749072|17
性爱中的禁忌|data/性爱中的禁忌|0|0|1346749072|1346749072|17
性爱也要有点“留白”|data/性爱也要有点“留白”|0|0|1346749072|1346749072|17
性爱技巧的关键在于变化|data/性爱技巧的关键在于变化|0|0|1346749072|1346749072|17
性爱时，该听什么音乐?|data/性爱时，该听什么音乐?|0|0|1346749072|1346749072|17
性爱的另类玩法之--SM性技巧|data/性爱的另类玩法之--SM性技巧|0|0|1346749072|1346749072|17
性爱的标准动作与步骤|data/性爱的标准动作与步骤|0|0|1346749072|1346749072|17
性爱缺一不可的三个阶段|data/性爱缺一不可的三个阶段|0|0|1346749072|1346749072|17
情侣外出旅游如何玩野战?|data/情侣外出旅游如何玩野战?|0|0|1346749072|1346749072|17
房中做爱地点排行TOP5|data/房中做爱地点排行TOP5|0|0|1346749072|1346749072|17
打造你的独特性爱风格|data/打造你的独特性爱风格|0|0|1346749072|1346749072|17
水中做爱，你尝试过吗?|data/水中做爱，你尝试过吗?|0|0|1346749072|1346749072|17
牙膏可以让性爱更加持久|data/牙膏可以让性爱更加持久|0|0|1346749072|1346749072|17
男人喜欢的捆绑性游戏以及扮演角色的性技巧|data/男人喜欢的捆绑性游戏以及扮演角色的性技巧|0|0|1346749072|1346749072|17
男人性爱的七个要诀|data/男人性爱的七个要诀|0|0|1346749072|1346749072|17
男女亲密时的标准步骤|data/男女亲密时的标准步骤|0|0|1346749072|1346749072|17
男女各种拥抱方式|data/男女各种拥抱方式|0|0|1346749072|1346749072|17
男快女慢怎样做到性同步|data/男快女慢怎样做到性同步|0|0|1346749072|1346749072|17
穿高跟鞋做爱的四种方式|data/穿高跟鞋做爱的四种方式|0|0|1346749072|1346749072|17
练练夫妻性爱的基本功|data/练练夫妻性爱的基本功|0|0|1346749072|1346749072|17
蝴蝶式的G点性刺激|data/蝴蝶式的G点性刺激|0|0|1346749072|1346749072|17
让任何女人都受不了的性技巧|data/让任何女人都受不了的性技巧|0|0|1346749072|1346749072|17
让女人尽性的4大花招|data/让女人尽性的4大花招|0|0|1346749072|1346749072|17
让女人快速高潮的基本方式|data/让女人快速高潮的基本方式|0|0|1346749072|1346749072|17
车震玩得过瘾的爱爱技巧|data/车震玩得过瘾的爱爱技巧|0|0|1346749072|1346749072|17
7种浪漫的吻技|data/7种浪漫的吻技|0|0|1346749071|1346749071|19
Kiss另类篇|data/Kiss另类篇|0|0|1346749071|1346749071|19
三种最佳口型的接吻解析|data/三种最佳口型的接吻解析|0|0|1346749071|1346749071|19
中国女性最反感的四种接吻方式|data/中国女性最反感的四种接吻方式|0|0|1346749071|1346749071|19
亲吻恋人吻落何处最高明?|data/亲吻恋人吻落何处最高明?|0|0|1346749071|1346749071|19
亲吻留痕挑地方|data/亲吻留痕挑地方|0|0|1346749071|1346749071|19
做爱前奏 浪漫亲吻训练班|data/做爱前奏 浪漫亲吻训练班|0|0|1346749071|1346749071|19
初吻必读|data/初吻必读|0|0|1346749071|1346749071|19
吻颈技巧|data/吻颈技巧|0|0|1346749071|1346749071|19
女孩初吻必读：睁眼接吻是最大禁忌|data/女孩初吻必读：睁眼接吻是最大禁忌|0|0|1346749071|1346749071|19
怎样接吻才是最享受的?|data/怎样接吻才是最享受的?|0|0|1346749071|1346749071|19
性爱前戏的完美接吻需要这样的技巧|data/性爱前戏的完美接吻需要这样的技巧|0|0|1346749071|1346749071|19
接吻-不同部位不同的感|data/接吻-不同部位不同的感觉|0|0|1346749071|1346749071|19
接吻必须注意的的五个问题|data/接吻必须注意的的五个问题|0|0|1346749071|1346749071|19
接吻的三个层次|data/接吻的三个层次|0|0|1346749071|1346749071|19
接吻的科学|data/接吻的科学|0|0|1346749071|1346749071|19
接吻第一课-基本步骤|data/接吻第一课-基本步骤|0|0|1346749071|1346749071|19
接吻第一课-注意事项|data/接吻第一课-注意事项|0|0|1346749071|1346749071|19
浑身触电的绝妙“吻技”|data/浑身触电的绝妙“吻技”|0|0|1346749071|1346749071|19
真空式接吻的方法|data/真空式接吻的方法|0|0|1346749071|1346749071|19
让你一吻定情的方法|data/让你一吻定情的方法|0|0|1346749071|1346749071|19
让女人失望到极点的接吻技巧|data/让女人失望到极点的接吻技巧|0|0|1346749071|1346749071|19
让男人很激动的10个女性接吻技巧|data/让男人很激动的10个女性接吻技巧|0|0|1346749071|1346749071|19
适合女人学的8种销魂的接吻花样|data/适合女人学的8种销魂的接吻花样|0|0|1346749071|1346749071|19
36个另类前戏小技巧|data/36个另类前戏小技巧|0|0|1346749071|1346749071|21
4个时刻前戏可以省掉前奏|data/4个时刻前戏可以省掉前奏|0|0|1346749071|1346749071|21
6招成就完美前戏|data/6招成就完美前戏|0|0|1346749071|1346749071|21
做爱前戏三问答|data/做爱前戏三问答|0|0|1346749071|1346749071|21
判断前戏效果的四窍门|data/判断前戏效果的四窍门|0|0|1346749071|1346749071|21
前戏时你的手应该放哪里?|data/前戏时你的手应该放哪里?|0|0|1346749071|1346749071|21
前戏是什么?|data/前戏是什么?|0|0|1346749071|1346749071|21
前戏是女性过性生活和谐的关键|data/前戏是女性过性生活和谐的关键|0|0|1346749071|1346749071|21
女人渴望被抚摸的神秘部位|data/女人渴望被抚摸的神秘部位|0|0|1346749071|1346749071|21
怎样帮伴侣擦润滑油?|data/怎样帮伴侣擦润滑油?|0|0|1346749071|1346749071|21
性生活中性爱抚的部位和手法|data/性生活中性爱抚的部位和手法|0|0|1346749071|1346749071|21
最好的前戏 教男人为伴侣按摩|data/最好的前戏 教男人为伴侣按摩|0|0|1346749071|1346749071|21
最完美的爱抚方式|data/最完美的爱抚方式|0|0|1346749071|1346749071|21
正确爱抚女性乳房的几个步骤|data/正确爱抚女�乳房的几个步骤|0|0|1346749071|1346749071|21
精油按摩法让情欲暴增|data/精油按摩法让情欲暴增|0|0|1346749071|1346749071|21
耳朵也是女人的敏感区|data/耳朵也是女人的敏感区|0|0|1346749071|1346749071|21
让她欲罢不能欲死欲仙的几分钟的性爱前戏|data/让她欲罢不能欲死欲仙的几分钟的性爱前戏|0|0|1346749071|1346749071|21
迂回前进才是“长久”之计|data/迂回前进才是“长久”之计|0|0|1346749071|1346749071|21
14种性爱姿势|data/14种性爱姿势|0|0|1346749071|1346749071|22
十二个经典性爱动作教程|data/十二个经典性爱动作教程|0|0|1346749071|1346749071|22
各国经典性爱姿势盘点|data/各国经典性爱姿势盘点|0|0|1346749071|1346749071|22
后入式性交全攻略|data/后入式性交全攻略|0|0|1346749071|1346749071|22
女人口述她最爱最喜欢的姿势|data/女人口述她最爱最喜欢的姿势|0|0|1346749071|1346749071|22
女人最爱的各种性爱姿势大盘点|data/女人最爱的各种性爱姿势大盘点|0|0|1346749071|1346749071|22
简述25种做爱姿势|data/简述25种做爱姿势|0|0|1346749071|1346749071|22
蝴蝶式性爱姿势 直接刺激G点|data/蝴蝶式性爱姿势 直接刺激G点|0|0|1346749071|1346749071|22
讨论一下常见的三种性爱姿势|data/讨论一下常见的三种性爱姿势|0|0|1346749071|1346749071|22
让你飘飘欲仙的性爱真经|data/让你飘飘欲仙的性爱真经|0|0|1346749071|1346749071|22
让女性在传教士体位中获得更多快感的方法|data/让女性在传教士体位中获得更多快感的方法|0|0|1346749071|1346749071|22
适合男性疲倦时的4个性爱姿势|data/适合男性疲倦时的4个性爱姿势|0|0|1346749071|1346749071|22
性爱姿势看我72变(01)|data/性爱姿势看我72变(01)|0|0|1347443296|1347443296|22
性爱姿势看我72变(02)|data/性爱姿势看我72变(02)|0|0|1347443360|1347443360|22
性爱姿势看我72变(03）|data/性爱姿势看我72变(03）|0|0|1347443399|1347443399|22
性爱姿势看我72变(06）|data/性爱姿势看我72变(06）|0|0|1347443430|1347443430|22
性爱姿势看我72变(04）|data/性爱姿势看我72变(04）|0|0|1347443434|1347443434|22
性爱姿势看我72变(05）|data/性爱姿势看我72变(05）|0|0|1347443434|1347443434|22
性爱姿势看我72变(07)|data/性爱姿势看我72变(07)|0|0|1347443440|1347443440|22
性爱姿势看我72变(09)|data/性爱姿势看我72变(09)|0|0|1347443466|1347443466|22
性爱姿势看我72变(10）|data/性爱姿势看我72变(10）|0|0|1347443478|1347443478|22
性爱姿势看我72变(11）|data/性爱姿势看我72变(11）|0|0|1347443491|1347443491|22
性爱姿势看我72变(12）|data/性爱姿势看我72变(12）|0|0|1347443525|1347443525|22
性爱姿势看我72变(08)|data/性爱姿势看我72变(08)|0|0|1347443575|1347443575|22
浴室里的缠绵性爱姿势|data/浴室里的缠绵性爱姿势|0|0|1347443859|1347443859|22
男上位与女上位的新花样|data/男上位与女上位的新花样|0|0|1347444565|1347444565|22
详解五种性爱姿势|data/详解五种性爱姿势|0|0|1347453007|1347453007|22
几种男性自慰手淫方法|data/几种男性自慰手淫方法|0|0|1346749071|1346749071|26
正确使用泄欲器具五个诀窍|data/正确使用泄欲器具五个诀窍|0|0|1346749071|1346749071|26
男人远离寂寞的独门7式自慰术|data/男人远离寂寞的独门7式自慰术|0|0|1346749071|1346749071|26
女人自摸技巧大公开|data/女人自摸技巧大公开|0|0|1346749070|1346749070|27
女性的自慰方式|data/女性的自慰方式|0|0|1346749070|1346749070|27
女性自慰手淫方法大全|data/女性自慰手淫方法大全|0|0|1346749070|1346749070|27
19岁小女友居然还带着个4岁儿子|data/19岁小女友居然还带着个4岁儿子|0|0|1346749076|1346749076|1
1年的婚姻断送8年的爱情|data/1年的婚姻断送8年的爱情|0|0|1346749076|1346749076|1
30岁男人的一夜 19岁女孩的一生|data/30岁男人的一夜 19岁女孩的一生|0|0|1346749076|1346749076|1
一厢情愿 我只是他20天临时情人|data/一厢情愿 我只是他20天临时情人|0|0|1346749076|1346749076|1
一夜情 女人的“收支”是否平衡|data/一夜情 女人的“收支”是否平衡|0|0|1346749076|1346749076|1
丈夫说我像妓女将我打得血流不止|data/丈夫说我像妓女将我打得血流不止|0|0|1346749076|1346749076|1
临近婚期 无情老公放弃我傍富婆|data/临近婚期 无情老公放弃我傍富婆|0|0|1346749076|1346749076|1
为财产我故意让公公蹂躏我的肉体|data/为财产我故意让公公蹂躏我的肉体|0|0|1346749076|1346749076|1
他要我和别的男人上床|data/他要我和别的男人上床|0|0|1346749076|1346749076|1
何时我竟沦落成他人口中的荡妇|data/何时我竟沦落成他人口中的荡妇|0|0|1346749076|1346749076|1
公公乱穿老公睡衣让我尴尬认错人|data/公公乱穿老公睡衣让我尴尬认错人|0|0|1346749076|1346749076|1
准岳父竟用20万来扼杀我的真情|data/准岳父竟用20万来扼杀我的真情|0|0|1346749076|1346749076|1
包容成了放纵他竟理直气壮的背叛|data/包容成了放纵他竟理直气壮的背叛|0|0|1346749076|1346749076|1
单身亦乐活 3个单身女人的幸福|data/单身亦乐活 3个单身女人的幸福|0|0|1346749076|1346749076|1
去串门老婆想和姐夫睡 打发我回家|data/去串门老婆想和姐夫睡 打发我回家|0|0|1346749076|1346749076|1
只因胸太大 男人都对我望而却步|data/只因胸太大 男人都对我望而却步|0|0|1346749076|1346749076|1
可恨老公要我参与他的换妻性游戏|data/可恨老公要我参与他的换妻性游戏|0|0|1346749076|1346749076|1
同居 让爱迷失在亲密的那段时光|data/同居 让爱迷失在亲密的那段时光|0|0|1346749076|1346749076|1
和不爱的人做爱 只为父母抱孙子|data/和不爱的人做爱 只为父母抱孙子|0|0|1346749076|1346749076|1
善用谎言 让他对我爱的死去活来|data/善用谎言 让他对我爱的死去活来|0|0|1346749076|1346749076|1
因我平胸 男友送D罩杯内衣讽刺我|data/因我平胸 男友送D罩杯内衣讽刺我|0|0|1346749076|1346749076|1
在同性婚姻枷锁中过着无性的生活|data/在同性婚姻枷锁中过着无性的生活|0|0|1346749076|1346749076|1
多次怀孕 男友竟说是我的责任|data/多次怀孕 男友竟说是我的责任|0|0|1346749076|1346749076|1
夜夜激情依然满足不了他的欲望|data/夜夜激情依然满足不了他的欲望|0|0|1346749076|1346749076|1
奔三女讲述 年轻女孩还不会享受|data/奔三女讲述 年轻女孩还不会享受|0|0|1346749076|1346749076|1
女友嫌我穷 去夜店找富豪献媚|data/女友嫌我穷 去夜店找富豪献媚|0|0|1346749076|1346749076|1
女友怀孕后我被告知孩子不是我的|data/女友怀孕后我被告知孩子不是我的|0|0|1346749076|1346749076|1
女友说只有我买了房才能接吻上床|data/女友说只有我买了房才能接吻上床|0|0|1346749076|1346749076|1
女房东大胆示爱害得我落荒而逃|data/女房东大胆示爱害得我落荒而逃|0|0|1346749076|1346749076|1
女郎敲门 竟问老公为何不接电话|data/女郎敲门 竟问老公为何不接电话|0|0|1346749076|1346749076|1
她约我出来只为让我帮她破处女膜|data/她约我出来只为让我帮她破处女膜|0|0|1346749076|1346749076|1
婆婆偷听我们爱爱 公公偷拿我们套套|data/婆婆偷听我们爱爱 公公偷拿我们套套|0|0|1346749076|1346749076|1
婆婆摄像头偷窥房事 批我像小姐|data/婆婆摄像头偷窥房事 批我像小姐|0|0|1346749076|1346749076|1
婚前 女友让我和她闺蜜试睡一夜|data/婚前 女友让我和她闺蜜试睡一夜|0|0|1346749076|1346749076|1
婚期将近男友偷吃让别人怀孕|data/婚期将近男友偷吃让别人怀孕|0|0|1346749076|1346749076|1
婚礼上 前夫曝我第一次的细节|data/婚礼上 前夫曝我第一次的细节|0|0|1346749076|1346749076|1
嫁了“富二代” 我的性福去哪了|data/嫁了“富二代” 我的性福去哪了|0|0|1346749076|1346749076|1
家庭冷暴力让我“冷”到痛彻心扉|data/家庭冷暴力让我“冷”到痛彻心扉|0|0|1346749076|1346749076|1
富豪千万想换我女友 我有点动摇|data/富豪千万想换我女友 我有点动摇|0|0|1346749076|1346749076|1
小三抢先怀孕 婆婆居然劝我让位|data/小三抢先怀孕 婆婆居然劝我让位|0|0|1346749076|1346749076|1
尴尬被偷拍网上直播我和老公性爱|data/尴尬被偷拍网上直播我和老公性爱|0|0|1346749076|1346749076|1
彪悍的夫家让我只做了22天的新娘|data/彪悍的夫家让我只做了22天的新娘|0|0|1346749076|1346749076|1
怀孕做威胁 你只能得到无爱婚姻|data/怀孕做威胁 你只能得到无爱婚姻|0|0|1346749076|1346749076|1
悔意晚矣六次流产醒悟不该当小三|data/悔意晚矣六次流产醒悟不该当小三|0|0|1346749076|1346749076|1
情敌是生活中最了解你的那个女人|data/情敌是生活中最了解你的那个女人|0|0|1346749076|1346749076|1
我与寂寞少妇的那一夜激情狂欢|data/我与寂寞少妇的那一夜激情狂欢|0|0|1346749076|1346749076|1
我与教练激情裸泳 逾越最后底线|data/我与教练激情裸泳 逾越最后底线|0|0|1346749076|1346749076|1
我和老公嘿咻太吵 遭婆婆砸门|data/我和老公嘿咻太吵 遭婆婆砸门|0|0|1346749076|1346749076|1
我和老公在火车上嘿咻遭骂|data/我和老公在火车上嘿咻遭骂|0|0|1346749076|1346749076|1
我拿性感诱人的胴体来征服男人|data/我拿性感诱人的胴体来征服男人|0|0|1346749076|1346749076|1
我玩一夜情来报复老公的精神出轨|data/我玩一夜情来报复老公的精神出轨|0|0|1346749076|1346749076|1
我用下体拯救留守妇女的空虚寂寞|data/我用下体拯救留守妇女的空虚寂寞|0|0|1346749076|1346749076|1
我的“裸”婚不被父母认同|data/我的“裸”婚不被父母认同|0|0|1346749076|1346749076|1
我真后悔把第一次献给了情场老手|data/我真后悔把第一次献给了情场老手|0|0|1346749076|1346749076|1
我离婚求真爱却遭情人玩弄背叛|data/我离婚求真爱却遭情人玩弄背叛|0|0|1346749076|1346749076|1
我被男友夺去初夜后犯贱倒贴|data/我被男友夺去初夜后犯贱倒贴|0|0|1346749076|1346749076|1
护士老婆上班时间老是骗我回家|data/护士老婆上班时间老是骗我回家|0|0|1346749076|1346749076|1
新婚夜和老公疯狂欢爱 我很满足|data/新婚夜和老公疯狂欢爱 我很满足|0|0|1346749076|1346749076|1
新婚蜜月归来 老公让伴娘怀了孕|data/新婚蜜月归来 老公让伴娘怀了孕|0|0|1346749076|1346749076|1
无情男友说不和他上床就是不爱他|data/无情男友说不和他上床就是不爱他|0|0|1346749076|1346749076|1
无耻老公出轨夸女同事床技比我强|data/无耻老公出轨夸女同事床技比我强|0|0|1346749076|1346749076|1
校长将“魔爪”伸进我的裙子里|data/校长将“魔爪”伸进我的裙子里|0|0|1346749076|1346749076|1
母亲为钱财将我打造成职业情妇|data/母亲为钱财将我打造成职业情妇|0|0|1346749076|1346749076|1
洞房夜 老婆生气一脚把我踹下床|data/洞房夜 老婆生气一脚把我踹下床|0|0|1346749076|1346749076|1
洞房夜老公让我模仿他前妻的姿势|data/洞房夜老公让我模仿他前妻的姿势|0|0|1346749076|1346749076|1
热恋半年 男友对我没有“冲动”|data/热恋半年 男友对我没有“冲动”|0|0|1346749076|1346749076|1
爱子心切 老公让前妻给孩子喂奶|data/爱子心切 老公让前妻给孩子喂奶|0|0|1346749076|1346749076|1
爱玩暧昧的男人真不值得我相信|data/爱玩暧昧的男人真不值得我相信|0|0|1346749076|1346749076|1
男友不顾我意愿强行纵欲|data/男友不顾我意愿强行纵欲|0|0|1346749076|1346749076|1
男友因我不奉献处女之身纵然分手|data/男友因我不奉献处女之身纵然分手|0|0|1346749076|1346749076|1
男友把套套藏进闺蜜的文胸|data/男友把套套藏进闺蜜的文胸|0|0|1346749076|1346749076|1
男友撞见我出轨 送我一盒套套|data/男友撞见我出轨 送我一盒套套|0|0|1346749076|1346749076|1
男友每次见面都逼我献初夜|data/男友每次见面都逼我献初夜|0|0|1346749076|1346749076|1
男友的“变态习惯”成分手的理由|data/男友的“变态习惯”成分手的理由|0|0|1346749076|1346749076|1
男友逼婚逼同房 行为就像偏执狂|data/男友逼婚逼同房 行为就像偏执狂|0|0|1346749076|1346749076|1
疯狂!我竟和顺风车司机车内偷情|data/疯狂!我竟和顺风车司机车内偷情|0|0|1346749076|1346749076|1
看见老公抱着闺蜜大腿午休|data/看见老公抱着闺蜜大腿午休|0|0|1346749076|1346749076|1
