G点|data/G点|0|0|1346749073|1346749073|12
包皮|data/包皮|0|0|1346749073|1346749073|12
射精|data/射精|0|0|1346749073|1346749073|12
忍精|data/忍精|0|0|1346749073|1346749073|12
性偏好|data/性偏好|0|0|1346749073|1346749073|12
性冲动|data/性冲动|0|0|1346749073|1346749073|12
性压抑|data/性压抑|0|0|1346749073|1346749073|12
性取向|data/性取向|0|0|1346749073|1346749073|12
性同步|data/性同步|0|0|1346749073|1346749073|12
性吸引|data/性吸引|0|0|1346749073|1346749073|12
性嫉妒|data/性嫉妒|0|0|1346749073|1346749073|12
性对抗|data/性对抗|0|0|1346749073|1346749073|12
性幻想|data/性幻想|0|0|1346749073|1346749073|12
性显象|data/性显象|0|0|1346749073|1346749073|12
性梦|data/性梦|0|0|1346749073|1346749073|12
性欲|data/性欲|0|0|1346749073|1346749073|12
性爱生理期|data/性爱生理期|0|0|1346749073|1346749073|12
性生活时差|data/性生活时差|0|0|1346749073|1346749073|12
性虐待|data/性虐待|0|0|1346749073|1346749073|12
性衰老|data/性衰老|0|0|1346749073|1346749073|12
性阈|data/性阈|0|0|1346749073|1346749073|12
性饥饿|data/性饥饿|0|0|1346749073|1346749073|12
更年期|data/更年期|0|0|1346749073|1346749073|12
月经|data/月经|0|0|1346749073|1346749073|12
梦交|data/梦交|0|0|1346749073|1346749073|12
爱液|data/爱液|0|0|1346749073|1346749073|12
男性不应期|data/男性不应期|0|0|1346749073|1346749073|12
精子|data/精子|0|0|1346749073|1346749073|12
纵欲|data/纵欲|0|0|1346749073|1346749073|12
自慰|data/自慰|0|0|1346749073|1346749073|12
荷尔蒙|data/荷尔蒙|0|0|1346749073|1346749073|12
蜜月病|data/蜜月病|0|0|1346749073|1346749073|12
遗精|data/遗精|0|0|1346749073|1346749073|12
阴吹|data/阴吹|0|0|1346749073|1346749073|12
阴道隔膜|data/阴道隔膜|0|0|1346749073|1346749073|12
“小弟弟”越大越好？够硬就行！|data/“小弟弟”越大越好？够硬就行！|0|0|1346749073|1346749073|8
一个让阴茎更强大的训练教程|data/一个让阴茎更强大的训练教程|0|0|1346749073|1346749073|8
六大指标全面衡量你是否够爷们|data/六大指标全面衡量你是否够爷们|0|0|1346749073|1346749073|8
关于男性生理的一些常识|data/关于男性生理的一些常识|0|0|1346749073|1346749073|8
十指连性：手指长度与性能力直接相关|data/十指连性：手指长度与性能力直接相关|0|0|1346749073|1346749073|8
夜间勃起反应男人真实性能力|data/夜间勃起反应男人真实性能力|0|0|1346749073|1346749073|8
女人最喜欢的阴茎尺寸大小|data/女人最喜欢的阴茎尺寸大小|0|0|1346749073|1346749073|8
如何科学测量阴茎长度?|data/如何科学测量阴茎长度?|0|0|1346749073|1346749073|8
小便射得远代表性能力强？|data/小便射得远代表性能力强？|0|0|1346749073|1346749073|8
尿和精液会不会同时排出来？|data/尿和精液会不会同时排出来？|0|0|1346749073|1346749073|8
必学：男人养精十招|data/必学：男人养精十招|0|0|1346749073|1346749073|8
揭秘男性正常的性生理数据|data/揭秘男性正常的性生理数据|0|0|1346749073|1346749073|8
男人“私处”的十五个小秘密|data/男人“私处”的十五个小秘密|0|0|1346749073|1346749073|8
男人一天中的四次性高潮|data/男人一天中的四次性高潮|0|0|1346749073|1346749073|8
男人一次射精射掉了多少精力?|data/男人一次射精射掉了多少精力?|0|0|1346749073|1346749073|8
男人一生的性欲曲线流程|data/男人一生的性欲曲线流程|0|0|1346749073|1346749073|8
男人一生精液有多少?|data/男人一生精液有多少?|0|0|1346749073|1346749073|8
男人体味是从什么秘处发出的?|data/男人体味是从什么秘处发出的?|0|0|1346749073|1346749073|8
男人多长时间遗精一次才算正常?|data/男人多长时间遗精一次才算正常?|0|0|1346749073|1346749073|8
男人正常的精液是什么样子?|data/男人正常的精液是什么样子?|0|0|1346749073|1346749073|8
男人真的会精尽而亡吗?|data/男人真的会精尽而亡吗?|0|0|1346749073|1346749073|8
男人精液你了解多少?|data/男人精液你了解多少?|0|0|1346749073|1346749073|8
男人裆部为何特别脆弱?|data/男人裆部为何特别脆弱?|0|0|1346749073|1346749073|8
男子从何时开始性衰老?|data/男子从何时开始性衰老?|0|0|1346749073|1346749073|8
男性也有生理周期|data/男性也有生理周期|0|0|1346749073|1346749073|8
男性的外生殖器官解析|data/男性的外生殖器官解析|0|0|1346749073|1346749073|8
男性阴囊生理解析|data/男性阴囊生理解析|0|0|1346749073|1346749073|8
男性阴茎必知的五大生理点|data/男性阴茎必知的五大生理点|0|0|1346749073|1346749073|8
男生殖系统各部分功能|data/男生殖系统各部分功能|0|0|1346749073|1346749073|8
睾丸产生精子的过程|data/睾丸产生精子的过程|0|0|1346749073|1346749073|8
睾丸小会影响生育能力吗?|data/睾丸小会影响生育能力吗?|0|0|1346749073|1346749073|8
精囊腺的主要作用|data/精囊腺的主要作用|0|0|1346749073|1346749073|8
精子的结构和功能|data/精子的结构和功能|0|0|1346749073|1346749073|8
谈谈你不知道的射精知识|data/谈谈你不知道的射精知识|0|0|1346749073|1346749073|8
适合才是最好：两性性器官的最佳匹配|data/适合才是最好：两性性器官的最佳匹配|0|0|1346749073|1346749073|8
阴茎为何早晨易勃起？|data/阴茎为何早晨易勃起？|0|0|1346749073|1346749073|8
阴茎勃起之“谜”|data/阴茎勃起之“谜”|0|0|1346749073|1346749073|8
阴茎勃起程度的自我判断|data/阴茎勃起程度的自我判断|0|0|1346749073|1346749073|8
阴茎短小对女性性快感有影响吗?|data/阴茎短小对女性性快感有影响吗?|0|0|1346749073|1346749073|8
阴茎衰老有三大表现要知道|data/阴茎衰老有三大表现要知道|0|0|1346749073|1346749073|8
阴茎长短与硬软|data/阴茎长短与硬软|0|0|1346749073|1346749073|8
附睾是男性生育的“掌舵者”|data/附睾是男性生育的“掌舵者”|0|0|1346749073|1346749073|8
附睾管的长度与生理功能|data/附睾管的长度与生理功能|0|0|1346749073|1346749073|8
附睾长什么样，长在哪里?|data/附睾长什么样，长在哪里?|0|0|1346749073|1346749073|8
男人阴茎完美长度是多少才最好?|data/男人阴茎完美长度是多少才最好?|0|0|1347445717|1347445717|8
A点、F区、R区、G点、U点，不懂的，一定要看！|data/A点、F区、R区、G点、U点，不懂的，一定要看！|0|0|1346749073|1346749073|9
为什么有的女子会发生闭经?|data/为什么有的女子会发生闭经?|0|0|1346749073|1346749073|9
乳房与性欲的因果联系|data/乳房与性欲的因果联系|0|0|1346749073|1346749073|9
乳房的内部结构|data/乳房的内部结构|0|0|1346749073|1346749073|9
什么是“石女”?|data/什么是“石女”?|0|0|1346749073|1346749073|9
关于女性性高潮的5个事实|data/关于女性性高潮的5个事实|0|0|1346749073|1346749073|9
关于阴道前庭|data/关于阴道前庭|0|0|1346749073|1346749073|9
判断前戏效果的四窍门|data/判断前戏效果的四窍门|0|0|1346749073|1346749073|9
告诉你真实的处女膜|data/告诉你真实的处女膜|0|0|1346749073|1346749073|9
处女膜能说明些什么?|data/处女膜能说明些什么?|0|0|1346749073|1346749073|9
女人20 30 40之性爱频率|data/女人20 30 40之性爱频率|0|0|1346749073|1346749073|9
女人一生的4个情欲高峰期|data/女人一生的4个情欲高峰期|0|0|1346749073|1346749073|9
女人对性的基本需求类型|data/女人对性的基本需求类型|0|0|1346749073|1346749073|9
女人性爱中哪个部位最敏感?|data/女人性爱中哪个部位最敏感?|0|0|1346749073|1346749073|9
女人期待男人爱抚的12个兴奋点|data/女人期待男人爱抚的12个兴奋点|0|0|1346749073|1346749073|9
女人私处的毛发到底有什么用?|data/女人私处的毛发到底有什么用?|0|0|1346749073|1346749073|9
女人私处的生理参数|data/女人私处的生理参数|0|0|1346749073|1346749073|9
女人阴道的8个秘密|data/女人阴道的8个秘密|0|0|1346749073|1346749073|9
女性乳房的性生理反应|data/女性乳房的性生理反应|0|0|1346749073|1346749073|9
女性处女膜到底在哪里？|data/女性处女膜到底在哪里？|0|0|1346749073|1346749073|9
女性床上性高潮时六种表现|data/女性床上性高潮时六种表现|0|0|1346749073|1346749073|9
女性性器官标准数据|data/女性性器官标准数据|0|0|1346749073|1346749073|9
女性的卵巢有什么用?|data/女性的卵巢有什么用?|0|0|1346749073|1346749073|9
女性阴道标准尺寸是多少?|data/女性阴道标准尺寸是多少?|0|0|1346749073|1346749073|9
女性阴部阴毛的特征|data/女性阴部阴毛的特征|0|0|1346749073|1346749073|9
女生在何时乳房丰满度最佳?|data/女生在何时乳房丰满度最佳?|0|0|1346749073|1346749073|9
如何得知处女膜是否破裂?|data/如何得知处女膜是否破裂?|0|0|1346749073|1346749073|9
引起女人射精的G点|data/引起女人射精的G点|0|0|1346749073|1346749073|9
性交中的阴蒂作用|data/性交中的阴蒂作用|0|0|1346749073|1346749073|9
性兴奋时女人的生理变化|data/性兴奋时女人的生理变化|0|0|1346749073|1346749073|9
性反应的标志-阴道液|data/性反应的标志-阴道液|0|0|1346749073|1346749073|9
性爱呻吟是生理反应吗?|data/性爱呻吟是生理反应吗?|0|0|1346749073|1346749073|9
性生活时乳房为何会硬?|data/性生活时乳房为何会硬?|0|0|1346749073|1346749073|9
性生活时女人的生理变化解析|data/性生活时女人的生理变化解析|0|0|1346749073|1346749073|9
性红晕 女人性高潮征兆|data/性红晕 女人性高潮征兆|0|0|1346749073|1346749073|9
教你认识月经|data/教你认识月经|0|0|1346749073|1346749073|9
月经周期的奥秘|data/月经周期的奥秘|0|0|1346749073|1346749073|9
生理常识-小阴唇是什么?|data/生理常识-小阴唇是什么?|0|0|1346749073|1346749073|9
细说女性外阴|data/细说女性外阴|0|0|1346749073|1346749073|9
阴唇乌黑的原因|data/阴唇乌黑的原因|0|0|1346749073|1346749073|9
阴唇在性反应中的不同变化|data/阴唇在性反应中的不同变化|0|0|1346749073|1346749073|9
阴毛与性欲有无关系|data/阴毛与性欲有无关系|0|0|1346749073|1346749073|9
阴道在性反应周期中的变化|data/阴道在性反应周期中的变化|0|0|1346749073|1346749073|9
阴道的小秘密|data/阴道的小秘密|0|0|1346749073|1346749073|9
阴道的结构及生理特点|data/阴道的结构及生理特点|0|0|1346749073|1346749073|9
阴道里面是怎么样的?|data/阴道里面是怎么样的?|0|0|1346749073|1346749073|9
女人高潮有哪些生理反应?|data/女人高潮有哪些生理反应?|0|0|1347445447|1347445447|9
男人必看：揭露女人高潮时的“爱液”|data/男人必看：揭露女人高潮时的“爱液”|0|0|1347445546|1347445546|9
中国人必知的五个性爱之神|data/中国人必知的五个性爱之神|0|0|1346749073|1346749073|11
中国博物馆展现中国古代性文化|data/中国博物馆展现中国古代性文化|0|0|1346749073|1346749073|11
全球七大“性都”性福指数大PK|data/全球七大“性都”性福指数大PK|0|0|1346749073|1346749073|11
印度的性文化|data/印度的性文化|0|0|1346749073|1346749073|11
历史上最不靠谱性爱风俗|data/历史上最不靠谱性爱风俗|0|0|1346749073|1346749073|11
古人的“房事诱导”|data/古人的“房事诱导”|0|0|1346749073|1346749073|11
古代人如何运用性技巧?|data/古代人如何运用性技巧?|0|0|1346749073|1346749073|11
古代艺妓与色妓们的四种归宿|data/古代艺妓与色妓们的四种归宿|0|0|1346749073|1346749073|11
史上十大“性爱”记录|data/史上十大“性爱”记录|0|0|1346749073|1346749073|11
土耳其人浴室里面选新娘|data/土耳其人浴室里面选新娘|0|0|1346749073|1346749073|11
土耳其的赔妻遮羞陋俗|data/土耳其的赔妻遮羞陋俗|0|0|1346749073|1346749073|11
外国男人都是“性超人”吗？|data/外国男人都是“性超人”吗？|0|0|1346749073|1346749073|11
妓女的起源|data/妓女的起源|0|0|1346749073|1346749073|11
强奸-日本传统性文化|data/强奸-日本传统性文化|0|0|1346749073|1346749073|11
性爱的男女艺术|data/性爱的男女艺术|0|0|1346749073|1346749073|11
日本会阳节 男子街上裸奔|data/日本会阳节 男子街上裸奔|0|0|1346749073|1346749073|11
日本文化中的“性”|data/日本文化中的“性”|0|0|1346749073|1346749073|11
日本色情文化的演变过程|data/日本色情文化的演变过程|0|0|1346749073|1346749073|11
欧洲人接吻大观|data/欧洲人接吻大观|0|0|1346749073|1346749073|11
武则天饱受性之累|data/武则天饱受性之累|0|0|1346749073|1346749073|11
泰国风情与性|data/泰国风情与性|0|0|1346749073|1346749073|11
话说中国古代春宫图大全|data/话说中国古代春宫图大全|0|0|1346749073|1346749073|11
调查显示 全球男女希望每周做爱三次|data/调查显示 全球男女希望每周做爱三次|0|0|1346749073|1346749073|11
趣说床文化|data/趣说床文化|0|0|1346749073|1346749073|11
金瓶梅与明末清初的性革命|data/金瓶梅与明末清初的性革命|0|0|1346749073|1346749073|11
飘零的日本“艺伎”文化|data/飘零的日本“艺伎”文化|0|0|1346749073|1346749073|11
日本文化色情电影和韩国伦理片|data/日本文化色情电影和韩国伦理片|0|0|1347446139|1347446139|11
两种有害的性交行为|data/两种有害的性交行为|0|0|1346749074|1346749074|7
中国男性性误区排行榜TOP10|data/中国男性性误区排行榜TOP10|0|0|1346749074|1346749074|7
五处地雷不容踩进|data/五处地雷不容踩进|0|0|1346749074|1346749074|7
保险套绝对安全吗?|data/保险套绝对安全吗?|0|0|1346749074|1346749074|7
做爱时过分“压迫”女性胸部|data/做爱时过分“压迫”女性胸部|0|0|1346749074|1346749074|7
偷情过度刺激容易造成猝死的危险|data/偷情过度刺激容易造成猝死的危险|0|0|1346749074|1346749074|7
六种常见男女性误区或致恶果|data/六种常见男女性误区或致恶果|0|0|1346749074|1346749074|7
关于避孕的11个误区|data/关于避孕的11个误区|0|0|1346749074|1346749074|7
哪些性观念是被混淆的?|data/哪些性观念是被混淆的?|0|0|1346749074|1346749074|7
夫妻生活后倒头就睡反而会更累?|data/夫妻生活后倒头就睡反而会更累?|0|0|1346749074|1346749074|7
夫妻生活时间越长越好吗?|data/夫妻生活时间越长越好吗?|0|0|1346749074|1346749074|7
夸张色情片中的性误导|data/夸张色情片中的性误导|0|0|1346749074|1346749074|7
女人常犯的5个“性误区”|data/女人常犯的5个“性误区”|0|0|1346749074|1346749074|7
女人常见的性观念误区|data/女人常见的性观念误区|0|0|1346749074|1346749074|7
女人要知道的四大性误区|data/女人要知道的四大性误区|0|0|1346749074|1346749074|7
性爱后千万不能做的4件事|data/性爱后千万不能做的4件事|0|0|1346749074|1346749074|7
性爱后大汗淋漓是肾虚表现吗?|data/性爱后大汗淋漓是肾虚表现吗?|0|0|1346749074|1346749074|7
性生活中有13个不要|data/性生活中有13个不要|0|0|1346749074|1346749074|7
性生活无高潮小心性误区|data/性生活无高潮小心性误区|0|0|1346749074|1346749074|7
性用具的四大使用误区|data/性用具的四大使用误区|0|0|1346749074|1346749074|7
性误区：我用夫妻生活减肥|data/性误区：我用夫妻生活减肥|0|0|1346749074|1346749074|7
手淫无罪，但频繁有害|data/手淫无罪，但频繁有害|0|0|1346749074|1346749074|7
水中过夫妻生活小心|data/水中过夫妻生活小心|0|0|1346749074|1346749074|7
洞房预习课：处理好男女性生理的差异|data/洞房预习课：处理好男女性生理的差异|0|0|1346749074|1346749074|7
洞房预习课：女性应正确认识男性的性行为|data/洞房预习课：女性应正确认识男性的性行为|0|0|1346749074|1346749074|7
洞房预习课：走出对性冷淡认识的误区|data/洞房预习课：走出对性冷淡认识的误区|0|0|1346749074|1346749074|7
洞房预习课：走出对手淫的看法的误区|data/洞房预习课：走出对手淫的看法的误区|0|0|1346749074|1346749074|7
洞房预习课：走出对遗精、月经认识上的误区|data/洞房预习课：走出对遗精、月经认识上的误区|0|0|1346749074|1346749074|7
洞房预习课：走出性生活认识上的误区|data/洞房预习课：走出性生活认识上的误区|0|0|1346749074|1346749074|7
洞房预习课：走出性观念的误区|data/洞房预习课：走出性观念的误区|0|0|1346749074|1346749074|7
男人二次高潮易损害性功能吗?|data/男人二次高潮易损害性功能吗?|0|0|1346749074|1346749074|7
男人射精就等于性高潮吗?|data/男人射精就等于性高潮吗?|0|0|1346749074|1346749074|7
男人有7大性误区 女人必须了解|data/男人有7大性误区 女人必须了解|0|0|1346749074|1346749074|7
经期同房可导致不孕|data/经期同房可导致不孕|0|0|1346749074|1346749074|7
经期行房会有何后果?|data/经期行房会有何后果?|0|0|1346749074|1346749074|7
解密10大性误区(男人比女人更渴望性吗)|data/解密10大性误区(男人比女人更渴望性吗)|0|0|1346749074|1346749074|7
这些性误区你知道多少?|data/这些性误区你知道多少?|0|0|1346749074|1346749074|7
这六大好事你最好别做|data/这六大好事你最好别做|0|0|1346749074|1346749074|7
这样性交易患病|data/这样性交易患病|0|0|1346749074|1346749074|7
远离10种性爱误区!|data/远离10种性爱误区!|0|0|1346749074|1346749074|7
远离成人电影里的性爱误区|data/远离成人电影里的性爱误区|0|0|1346749074|1346749074|7
野外性爱有哪些性误区?|data/野外性爱有哪些性误区?|0|0|1346749074|1346749074|7
长期服用伟哥会严重伤精|data/长期服用伟哥会严重伤精|0|0|1346749074|1346749074|7
非常危险的性前戏盘点|data/非常危险的性前戏盘点|0|0|1346749074|1346749074|7
骑自行车会影响性功能吗?|data/骑自行车会影响性功能吗?|0|0|1346749074|1346749074|7
13个鲜为人知的性爱秘事|data/13个鲜为人知的性爱秘事|0|0|1346749073|1346749073|6
26个Tips让婚姻性感起来|data/26个Tips让婚姻性感起来|0|0|1346749073|1346749073|6
A片中该学和不该学的镜头|data/A片中该学和不该学的镜头|0|0|1346749073|1346749073|6
“婚睡”对恢复精力很重要|data/“婚睡”对恢复精力很重要|0|0|1346749073|1346749073|6
“爱爱”中的12个要注意的事|data/“爱爱”中的12个要注意的事|0|0|1346749073|1346749073|6
专家建议：做爱时间顺其自然好|data/专家建议：做爱时间顺其自然好|0|0|1346749073|1346749073|6
专家：女性前戏至少要15分钟|data/专家：女性前戏至少要15分钟|0|0|1346749073|1346749073|6
五个最佳床下性爱场所|data/五个最佳床下性爱场所|0|0|1346749073|1346749073|6
人体性敏感点可随年龄发生变化|data/人体性敏感点可随年龄发生变化|0|0|1346749073|1346749073|6
做爱前请先关手机|data/做爱前请先关手机|0|0|1346749073|1346749073|6
六个日常习惯可增强性能力|data/六个日常习惯可增强性能力|0|0|1346749073|1346749073|6
告诉她 让她喜欢做|data/告诉她 让她喜欢做|0|0|1346749073|1346749073|6
困惑！前戏不是越久越好？|data/困惑！前戏不是越久越好？|0|0|1346749073|1346749073|6
夫妻性生活和谐基本的知识|data/夫妻性生活和谐基本的知识|0|0|1346749073|1346749073|6
夫妻性生活过度易引起疾病|data/夫妻性生活过度易引起疾病|0|0|1346749073|1346749073|6
女人对男人性爱行动大投诉|data/女人对男人性爱行动大投诉|0|0|1346749073|1346749073|6
女人的性爱有十诫|data/女人的性爱有十诫|0|0|1346749073|1346749073|6
女人看了痛快男人看了必学乖|data/女人看了痛快男人看了必学乖|0|0|1346749073|1346749073|6
女性如何巧妙拒绝他的性要求?|data/女性如何巧妙拒绝他的性要求?|0|0|1346749073|1346749073|6
女性性生活后喝果汁有利健康|data/女性性生活后喝果汁有利健康|0|0|1346749073|1346749073|6
如何缓解男人性心理压力?|data/如何缓解男人性心理压力?|0|0|1346749073|1346749073|6
妻子孕期男人怎么办?|data/妻子孕期男人怎么办?|0|0|1346749073|1346749073|6
怎样的A片才能让女生兴致盎然|data/怎样的A片才能让女生兴致盎然|0|0|1346749073|1346749073|6
怎样的性生活让夫妻更健康?|data/怎样的性生活让夫妻更健康?|0|0|1346749073|1346749073|6
性交后喝冷饮会会致命吗?|data/性交后喝冷饮会会致命吗?|0|0|1346749073|1346749073|6
性欲丧失的七个信号！|data/性欲丧失的七个信号！|0|0|1346749073|1346749073|6
性爱中女性应该多动动|data/性爱中女性应该多动动|0|0|1346749073|1346749073|6
性爱中的“七损八益”|data/性爱中的“七损八益”|0|0|1346749073|1346749073|6
性爱后隔多久排尿最及时?|data/性爱后隔多久排尿最及时?|0|0|1346749073|1346749073|6
性爱时男性最没礼貌的几种表现|data/性爱时男性最没礼貌的几种表现|0|0|1346749073|1346749073|6
性生活与失眠的紧密关系|data/性生活与失眠的紧密关系|0|0|1346749073|1346749073|6
性生活后喝点什么好?|data/性生活后喝点什么好?|0|0|1346749073|1346749073|6
性生活过后应暂缓驾车|data/性生活过后应暂缓驾车|0|0|1346749073|1346749073|6
性生活过度有哪些感觉?|data/性生活过度有哪些感觉?|0|0|1346749073|1346749073|6
性生活需躲开的黑色时间|data/性生活需躲开的黑色时间|0|0|1346749073|1346749073|6
性高潮后你忘了些什么?|data/性高潮后你忘了些什么?|0|0|1346749073|1346749073|6
房事前后洗澡有讲究|data/房事前后洗澡有讲究|0|0|1346749073|1346749073|6
按摩可以增强男人性能力|data/按摩可以增强男人性能力|0|0|1346749073|1346749073|6
早晨做爱后为何休息半小时?|data/早晨做爱后为何休息半小时?|0|0|1346749073|1346749073|6
流产多久能正常性生活?|data/流产多久能正常性生活?|0|0|1346749073|1346749073|6
用错安全套可成“性无能”|data/用错安全套可成“性无能”|0|0|1346749073|1346749073|6
男女切记七个时间不宜行房事|data/男女切记七个时间不宜行房事|0|0|1346749073|1346749073|6
男女间有哪些助性食品?|data/男女间有哪些助性食品?|0|0|1346749073|1346749073|6
男性多吃苹果可保护性功能|data/男性多吃苹果可保护性功能|0|0|1346749073|1346749073|6
男性第一次性生活中的常见尴尬|data/男性第一次性生活中的常见尴尬|0|0|1346749073|1346749073|6
自慰虽好但不可纵欲|data/自慰虽好但不可纵欲|0|0|1346749073|1346749073|6
身体疲乏不宜过性生活|data/身体疲乏不宜过性生活|0|0|1346749073|1346749073|6
过刺激的性生活必须注意的几个问题|data/过刺激的性生活必须注意的几个问题|0|0|1346749073|1346749073|6
还没性爱就累了为什么?|data/还没性爱就累了为什么?|0|0|1346749073|1346749073|6
这7招提高性生活质量|data/这7招提高性生活质量|0|0|1346749073|1346749073|6
骑车健身警惕扫“性”|data/骑车健身警惕扫“性”|0|0|1346749073|1346749073|6
11种错误的避孕观念|data/11种错误的避孕观念|0|0|1346749072|1346749072|10
4种最容易搞出“人命”的避孕方法|data/4种最容易搞出“人命”的避孕方法|0|0|1346749072|1346749072|10
一名妇科医生的避孕经验|data/一名妇科医生的避孕经验|0|0|1346749072|1346749072|10
不会避孕的男人不配爱|data/不会避孕的男人不配爱|0|0|1346749072|1346749072|10
不同薄厚安全套各有功效|data/不同薄厚安全套各有功效|0|0|1346749072|1346749072|10
不宜选用“安全期避孕”的女人|data/不宜选用“安全期避孕”的女人|0|0|1346749072|1346749072|10
不影响性交快感的避孕技巧|data/不影响性交快感的避孕技巧|0|0|1346749072|1346749072|10
五花八门的避孕方法哪种最安全?|data/五花八门的避孕方法哪种最安全?|0|0|1346749072|1346749072|10
产后性生活可以不避孕吗？|data/产后性生活可以不避孕吗？|0|0|1346749072|1346749072|10
人流后女性常见健康问题 对症解决|data/人流后女性常见健康问题 对症解决|0|0|1346749072|1346749072|10
人流好还是药流好？|data/人流好还是药流好？|0|0|1346749072|1346749072|10
人类安全套360年的演变|data/人类安全套360年的演变|0|0|1346749072|1346749072|10
什么样的性交姿势最不容易受孕?|data/什么样的性交姿势最不容易受孕?|0|0|1346749072|1346749072|10
体外射精带来的“后遗症”|data/体外射精带来的“后遗症”|0|0|1346749072|1346749072|10
你知道避孕套的神奇妙用吗?|data/你知道避孕套的神奇妙用吗?|0|0|1346749072|1346749072|10
使用安全套时细节不容忽视|data/使用安全套时细节不容忽视|0|0|1346749072|1346749072|10
具有避孕效果的几种食物|data/具有避孕效果的几种食物|0|0|1346749072|1346749072|10
初为人母13类避孕方法各不同|data/初为人母13类避孕方法各不同|0|0|1346749072|1346749072|10
十种情况不可服避孕药|data/十种情况不可服避孕药|0|0|1346749072|1346749072|10
吃避孕药5种常见不良反应及解决办法|data/吃避孕药5种常见不良反应及解决办法|0|0|1346749072|1346749072|10
