吃避孕药会变胖吗？|data/吃避孕药会变胖吗？|0|0|1346749072|1346749072|10
吃避孕药出现不良反应 小技巧缓解不适|data/吃避孕药出现不良反应 小技巧缓解不适|0|0|1346749072|1346749072|10
吃避孕药同时要补什么？|data/吃避孕药同时要补什么？|0|0|1346749072|1346749072|10
哪些姿势让你次次怀孕?|data/哪些姿势让你次次怀孕?|0|0|1346749072|1346749072|10
哪些技巧会让安全套更安全?|data/哪些技巧会让安全套更安全?|0|0|1346749072|1346749072|10
哪些避孕措施会影响性功能?|data/哪些避孕措施会影响性功能?|0|0|1346749072|1346749072|10
外用避孕药的注意事项|data/外用避孕药的注意事项|0|0|1346749072|1346749072|10
女人最喜欢用什么方法避孕?|data/女人最喜欢用什么方法避孕?|0|0|1346749072|1346749072|10
女性吃紧急避孕药要注意什么?|data/女性吃紧急避孕药要注意什么?|0|0|1346749072|1346749072|10
女性生理安全期该怎么计算?|data/女性生理安全期该怎么计算?|0|0|1346749072|1346749072|10
女性绝对的安全期是哪几天？|data/女性绝对的安全期是哪几天？|0|0|1346749072|1346749072|10
女性须知的一些避孕常识|data/女性须知的一些避孕常识|0|0|1346749072|1346749072|10
女性，安全期及避孕、受孕全攻略|data/女性，安全期及避孕、受孕全攻略|0|0|1346749072|1346749072|10
女用避孕套有何优点?|data/女用避孕套有何优点?|0|0|1346749072|1346749072|10
如何判断该选择何种流产方式?|data/如何判断该选择何种流产方式?|0|0|1346749072|1346749072|10
如何正确安全地使用套套?|data/如何正确安全地使用套套?|0|0|1346749072|1346749072|10
如何选择最合适的避孕药?|data/如何选择最合适的避孕药?|0|0|1346749072|1346749072|10
如何选购合适的避孕套?|data/如何选购合适的避孕套?|0|0|1346749072|1346749072|10
妇科专家提醒女性月经期也可能怀孕|data/妇科专家提醒女性月经期也可能怀孕|0|0|1346749072|1346749072|10
安全套知识你了解多少?|data/安全套知识你了解多少?|0|0|1346749072|1346749072|10
怀孕了如何性爱指南?|data/怀孕了如何性爱指南?|0|0|1346749072|1346749072|10
愚蠢避孕可导致性功能障碍|data/愚蠢避孕可导致性功能障碍|0|0|1346749072|1346749072|10
教你推算安全期和排卵期|data/教你推算安全期和排卵期|0|0|1346749072|1346749072|10
无痛人流的最佳时间是什么时候?|data/无痛人流的最佳时间是什么时候?|0|0|1346749072|1346749072|10
未婚女性最佳避孕方式全攻略|data/未婚女性最佳避孕方式全攻略|0|0|1346749072|1346749072|10
正确使用避孕套避孕4个方法|data/正确使用避孕套避孕4个方法|0|0|1346749072|1346749072|10
每个女人的安全期都不同|data/每个女人的安全期都不同|0|0|1346749072|1346749072|10
比较容易避孕的性爱姿势|data/比较容易避孕的性爱姿势|0|0|1346749072|1346749072|10
男性常用的避孕方法有哪些?|data/男性常用的避孕方法有哪些?|0|0|1346749072|1346749072|10
男性避孕套的正确使用方法|data/男性避孕套的正确使用方法|0|0|1346749072|1346749072|10
男性避孕药物有哪些?|data/男性避孕药物有哪些?|0|0|1346749072|1346749072|10
科学使用避孕套16个细节|data/科学使用避孕套16个细节|0|0|1346749072|1346749072|10
科学避孕，方法多多|data/科学避孕，方法多多|0|0|1346749072|1346749072|10
第一次性爱学会如何避孕|data/第一次性爱学会如何避孕|0|0|1346749072|1346749072|10
紧急避孕须注意七件事|data/紧急避孕须注意七件事|0|0|1346749072|1346749072|10
给吃避孕药避孕的女性推荐的食谱|data/给吃避孕药避孕的女性推荐的食谱|0|0|1346749072|1346749072|10
草莓、巧克力味的安全套不能用|data/草莓、巧克力味的安全套不能用|0|0|1346749072|1346749072|10
超薄安全套不是每个男人都适用|data/超薄安全套不是每个男人都适用|0|0|1346749072|1346749072|10
近六成人用错安全套|data/近六成人用错安全套|0|0|1346749072|1346749072|10
避孕后发生怀孕怎么办?|data/避孕后发生怀孕怎么办?|0|0|1346749072|1346749072|10
避孕套功效与薄厚程度有关|data/避孕套功效与薄厚程度有关|0|0|1346749072|1346749072|10
避孕套破了怎么办?|data/避孕套破了怎么办?|0|0|1346749072|1346749072|10
避孕套要怎么选怎么用才最安全?|data/避孕套要怎么选怎么用才最安全?|0|0|1346749072|1346749072|10
避孕药7个常见疑问|data/避孕药7个常见疑问|0|0|1346749072|1346749072|10
避孕药一个月最多不要超过几次?|data/避孕药一个月最多不要超过几次?|0|0|1346749072|1346749072|10
避孕药十大妙用与经痛说拜拜|data/避孕药十大妙用与经痛说拜拜|0|0|1346749072|1346749072|10
阴道冲洗能够避孕和防性病吗？|data/阴道冲洗能够避孕和防性病吗？|0|0|1346749072|1346749072|10
4招让"大姨妈"不再刁难你|data/4招让"大姨妈"不再刁难你|0|0|1346749072|1346749072|16
八招预防女性更年期综合症|data/八招预防女性更年期综合症|0|0|1346749072|1346749072|16
女人月经出现这些状况很可怕|data/女人月经出现这些状况很可怕|0|0|1346749072|1346749072|16
女性须知 夏季常吹空调容易痛经|data/女性须知 夏季常吹空调容易痛经|0|0|1346749072|1346749072|16
如何确诊多囊卵巢综合症|data/如何确诊多囊卵巢综合症|0|0|1346749072|1346749072|16
教你如何摆脱更年期四大症状|data/教你如何摆脱更年期四大症状|0|0|1346749072|1346749072|16
有些女人为什么痛经？|data/有些女人为什么痛经？|0|0|1346749072|1346749072|16
治愈十大经期“怪病”小妙招|data/治愈十大经期“怪病”小妙招|0|0|1346749072|1346749072|16
缓解各种类型的痛经方法|data/缓解各种类型的痛经方法|0|0|1346749072|1346749072|16
闭经的症状有哪些 早发现早治疗|data/闭经的症状有哪些 早发现早治疗|0|0|1346749072|1346749072|16
七个步骤有效自治早泄|data/七个步骤有效自治早泄|0|0|1346749072|1346749072|15
丈夫阳萎了，妻子怎么办？|data/丈夫阳萎了，妻子怎么办？|0|0|1346749072|1346749072|15
不射精症与无精症的区别|data/不射精症与无精症的区别|0|0|1346749072|1346749072|15
专家解析青少年出现早泄的原因|data/专家解析青少年出现早泄的原因|0|0|1346749072|1346749072|15
五大绝招激起男人的“欲火”|data/五大绝招激起男人的“欲火”|0|0|1346749072|1346749072|15
什么习惯让男人容易阳痿？|data/什么习惯让男人容易阳痿？|0|0|1346749072|1346749072|15
什么是性欲亢进?|data/什么是性欲亢进?|0|0|1346749072|1346749072|15
关于包皮包茎8个经典问题|data/关于包皮包茎8个经典问题|0|0|1346749072|1346749072|15
关于包皮包茎的一些误区|data/关于包皮包茎的一些误区|0|0|1346749072|1346749072|15
几个技巧解决早泄|data/几个技巧解决早泄|0|0|1346749072|1346749072|15
功能性不射精原因有三|data/功能性不射精原因有三|0|0|1346749072|1346749072|15
包皮包茎的危害有哪些？|data/包皮包茎的危害有哪些？|0|0|1346749072|1346749072|15
包皮手术后多久可以同房？|data/包皮手术后多久可以同房？|0|0|1346749072|1346749072|15
包皮手术的一些问题|data/包皮手术的一些问题|0|0|1346749072|1346749072|15
包皮过长与包茎是什么，如何区分?|data/包皮过长与包茎是什么，如何区分?|0|0|1346749072|1346749072|15
包皮过长如何使用避孕套？|data/包皮过长如何使用避孕套？|0|0|1346749072|1346749072|15
包皮过长手术术前术后注意事项|data/包皮过长手术术前术后注意事项|0|0|1346749072|1346749072|15
女性的哪些行为可能导致男人阳萎？|data/女性的哪些行为可能导致男人阳萎？|0|0|1346749072|1346749072|15
如何判断是否患上性冷淡?|data/如何判断是否患上性冷淡?|0|0|1346749072|1346749072|15
如何正确区分早泄和肾虚？|data/如何正确区分早泄和肾虚？|0|0|1346749072|1346749072|15
导致早泄的三大主要因素|data/导致早泄的三大主要因素|0|0|1346749072|1346749072|15
导致阳痿早泄有哪些心理原因|data/导致阳痿早泄有哪些心理原因|0|0|1346749072|1346749072|15
导致阳痿的原因有哪些？|data/导致阳痿的原因有哪些？|0|0|1346749072|1346749072|15
射精障碍有哪些?|data/射精障碍有哪些?|0|0|1346749072|1346749072|15
应对早泄分清病情等级再治疗|data/应对早泄分清病情等级再治疗|0|0|1346749072|1346749072|15
应对男性性冷淡需要身心并治|data/应对男性性冷淡需要身心并治|0|0|1346749072|1346749072|15
引起男人阳痿的几个因素|data/引起男人阳痿的几个因素|0|0|1346749072|1346749072|15
引起精神性早泄的8个原因|data/引起精神性早泄的8个原因|0|0|1346749072|1346749072|15
怎样才要做包皮包茎手术？|data/怎样才要做包皮包茎手术？|0|0|1346749072|1346749072|15
性欲低下？试试三个秘方|data/性欲低下？试试三个秘方|0|0|1346749072|1346749072|15
性欲减退后的自省|data/性欲减退后的自省|0|0|1346749072|1346749072|15
拒绝早泄 这些“担心”没必要|data/拒绝早泄 这些“担心”没必要|0|0|1346749072|1346749072|15
教你正确判断有无早泄|data/教你正确判断有无早泄|0|0|1346749072|1346749072|15
教你认识性冷淡|data/教你认识性冷淡|0|0|1346749072|1346749072|15
早泄 你越想避免越容易发生|data/早泄 你越想避免越容易发生|0|0|1346749072|1346749072|15
早泄患者该吃哪些食物？|data/早泄患者该吃哪些食物？|0|0|1346749072|1346749072|15
早泄有哪些类型？|data/早泄有哪些类型？|0|0|1346749072|1346749072|15
早泄治疗应远离这三种错误|data/早泄治疗应远离这三种错误|0|0|1346749072|1346749072|15
早泄认知的五个误区|data/早泄认知的五个误区|0|0|1346749072|1346749072|15
根据勃起程度自我判断阳痿|data/根据勃起程度自我判断阳痿|0|0|1346749072|1346749072|15
治疗“三结合” 轻松脱离阳痿|data/治疗“三结合” 轻松脱离阳痿|0|0|1346749072|1346749072|15
治疗包皮包茎大概花多少钱？|data/治疗包皮包茎大概花多少钱？|0|0|1346749072|1346749072|15
治疗性欲亢进分五步走|data/治疗性欲亢进分五步走|0|0|1346749072|1346749072|15
淡定！走出阳痿认知误区|data/淡定！走出阳痿认知误区|0|0|1346749072|1346749072|15
男人为何迟迟不射精?|data/男人为何迟迟不射精?|0|0|1346749072|1346749072|15
男人偶尔“不坚”并不是真阳痿|data/男人偶尔“不坚”并不是真阳痿|0|0|1346749072|1346749072|15
男人忍精不射会酿“苦果”|data/男人忍精不射会酿“苦果”|0|0|1346749072|1346749072|15
男人服用“伟哥”先搞清5件事|data/男人服用“伟哥”先搞清5件事|0|0|1346749072|1346749072|15
男人的6个难言之疾|data/男人的6个难言之疾|0|0|1346749072|1346749072|15
男性割包皮后该注意什么？|data/男性割包皮后该注意什么？|0|0|1346749072|1346749072|15
男性如何应对过度遗精?|data/男性如何应对过度遗精?|0|0|1346749072|1346749072|15
男性防早泄锻炼秘法详解|data/男性防早泄锻炼秘法详解|0|0|1346749072|1346749072|15
男性阳痿和早泄的不同定义及症状|data/男性阳痿和早泄的不同定义及症状|0|0|1346749072|1346749072|15
看男科病前最好补充点知识|data/看男科病前最好补充点知识|0|0|1346749072|1346749072|15
让你告别早泄的十三招|data/让你告别早泄的十三招|0|0|1346749072|1346749072|15
让男人不再阳痿的技巧|data/让男人不再阳痿的技巧|0|0|1346749072|1346749072|15
让男人性冷淡的四个原因|data/让男人性冷淡的四个原因|0|0|1346749072|1346749072|15
适合许多人用的预防早泻的方法|data/适合许多人用的预防早泻的方法|0|0|1346749072|1346749072|15
阳痿就是肾虚造成的吗？|data/阳痿就是肾虚造成的吗？|0|0|1346749072|1346749072|15
阳痿早泄男人必须知道的几个问题|data/阳痿早泄男人必须知道的几个问题|0|0|1346749072|1346749072|15
阳痿的症状有哪些？|data/阳痿的症状有哪些？|0|0|1346749072|1346749072|15
预防阳痿离不开良好的睡眠|data/预防阳痿离不开良好的睡眠|0|0|1346749072|1346749072|15
10种食物让女性“春心荡漾”|data/10种食物让女性“春心荡漾”|0|0|1346749072|1346749072|14
“水果伟哥”枸杞被西方人大力追捧|data/“水果伟哥”枸杞被西方人大力追捧|0|0|1346749072|1346749072|14
两性保健食谱（木瓜、荔枝、莲子）|data/两性保健食谱（木瓜、荔枝、莲子）|0|0|1346749072|1346749072|14
做爱后吃点什么好?|data/做爱后吃点什么好?|0|0|1346749072|1346749072|14
几种对男人性欲有提高作用的肉类|data/几种对男人性欲有提高作用的肉类|0|0|1346749072|1346749072|14
助性食物和败性食物大PK|data/助性食物和败性食物大PK|0|0|1346749072|1346749072|14
可增精子产量的水果|data/可增精子产量的水果|0|0|1346749072|1346749072|14
吃对水果可以提升性能力|data/吃对水果可以提升性能力|0|0|1346749072|1346749072|14
吃得太油腻不利于男性勃起|data/吃得太油腻不利于男性勃起|0|0|1346749072|1346749072|14
合理饮食浇灌"性"福之花|data/合理饮食浇灌"性"福之花|0|0|1346749072|1346749072|14
哪些食物让你没有了性欲?|data/哪些食物让你没有了性欲?|0|0|1346749072|1346749072|14
喝酒不如喝咖啡助性来的健康|data/喝酒不如喝咖啡助性来的健康|0|0|1346749072|1346749072|14
多吃姜可治性功能障碍|data/多吃姜可治性功能障碍|0|0|1346749072|1346749072|14
多吃茭白等寒性食品会败性|data/多吃茭白等寒性食品会败性|0|0|1346749072|1346749072|14
夫妻间最爱的七大助性食物|data/夫妻间最爱的七大助性食物|0|0|1346749072|1346749072|14
女人有性趣的食物|data/女人有性趣的食物|0|0|1346749072|1346749072|14
女性性生活后喝果汁有利健康|data/女性性生活后喝果汁有利健康|0|0|1346749072|1346749072|14
巧克力是比接吻还激情的绝招|data/巧克力是比接吻还激情的绝招|0|0|1346749072|1346749072|14
性爱前饮食需提前一小时|data/性爱前饮食需提前一小时|0|0|1346749072|1346749072|14
性爱后吃鸡蛋能让体力恢复更快|data/性爱后吃鸡蛋能让体力恢复更快|0|0|1346749072|1346749072|14
房事后口渴喝点什么益健康?|data/房事后口渴喝点什么益健康?|0|0|1346749072|1346749072|14
房事过度如何进行饮食调养?|data/房事过度如何进行饮食调养?|0|0|1346749072|1346749072|14
提高男性性能量的食物|data/提高男性性能量的食物|0|0|1346749072|1346749072|14
最廉价的“水果伟哥”|data/最廉价的“水果伟哥”|0|0|1346749072|1346749072|14
烧烤成了“不举”的“主凶”|data/烧烤成了“不举”的“主凶”|0|0|1346749072|1346749072|14
牛蒡海带汤有助于提高性爱质量|data/牛蒡海带汤有助于提高性爱质量|0|0|1346749072|1346749072|14
甘草好但是不能使用过量|data/甘草好但是不能使用过量|0|0|1346749072|1346749072|14
男性夏天提升性能力8种饮品|data/男性夏天提升性能力8种饮品|0|0|1346749072|1346749072|14
让乳房更丰满的食物|data/让乳房更丰满的食物|0|0|1346749072|1346749072|14
让你欲望high到爆的食物|data/让你欲望high到爆的食物|0|0|1346749072|1346749072|14
让男人“性起”的合理饮食|data/让男人“性起”的合理饮食|0|0|1346749072|1346749072|14
调理月经：羊肉滋补汤|data/调理月经：羊肉滋补汤|0|0|1346749072|1346749072|14
这样吃火锅-女人滋阴 男人壮阳|data/这样吃火锅-女人滋阴 男人壮阳|0|0|1346749072|1346749072|14
适当饮红茶可提高性兴奋|data/适当饮红茶可提高性兴奋|0|0|1346749072|1346749072|14
食物对性功能的利或害|data/食物对性功能的利或害|0|0|1346749072|1346749072|14
鲜虾比壮阳药更壮阳|data/鲜虾比壮阳药更壮阳|0|0|1346749072|1346749072|14
黄瓜等有助于激发女性的性欲|data/黄瓜等有助于激发女性的性欲|0|0|1346749072|1346749072|14
10种常见的性交后阴道出血原因|data/10种常见的性交后阴道出血原因|0|0|1346749072|1346749072|13
为何射精后肛门疼痛？|data/为何射精后肛门疼痛？|0|0|1346749072|1346749072|13
为爱侣口交也会带来疾病|data/为爱侣口交也会带来疾病|0|0|1346749072|1346749072|13
亲爱的，行房前请你先洗手|data/亲爱的，行房前请你先洗手|0|0|1346749072|1346749072|13
做爱时射精疼痛的原因|data/做爱时射精疼痛的原因|0|0|1346749072|1346749072|13
做爱时怎么保护阴茎不在激烈的运动中受伤?|data/做爱时怎么保护阴茎不在激烈的运动中受伤?|0|0|1346749072|1346749072|13
利用洗澡增强男人性“力”|data/利用洗澡增强男人性“力”|0|0|1346749072|1346749072|13
喷头冲洗按摩阴茎可增强性功能|data/喷头冲洗按摩阴茎可增强性功能|0|0|1346749072|1346749072|13
夏季适量剃除阴毛可保女性卫生健康|data/夏季适量剃除阴毛可保女性卫生健康|0|0|1346749072|1346749072|13
夫妻性生活过后出现身体酸痛如何处理?|data/夫妻性生活过后出现身体酸痛如何处理?|0|0|1346749072|1346749072|13
夫妻生活后要及时“排空”|data/夫妻生活后要及时“排空”|0|0|1346749072|1346749072|13
女人保健10招推迟衰老的到来|data/女人保健10招推迟衰老的到来|0|0|1346749072|1346749072|13
女人私密地带保湿手册|data/女人私密地带保湿手册|0|0|1346749072|1346749072|13
女人该如何保护自己的乳房|data/女人该如何保护自己的乳房|0|0|1346749072|1346749072|13
女性月经期间应该多吃什么少吃什么?|data/女性月经期间应该多吃什么少吃什么?|0|0|1346749072|1346749072|13
女性该如何保护乳房防止衰老|data/女性该如何保护乳房防止衰老|0|0|1346749072|1346749072|13
妻间甜蜜的性爱过程中容易产生的5大伤害|data/妻间甜蜜的性爱过程中容易产生的5大伤害|0|0|1346749072|1346749072|13
子宫特殊时期请暂停性生活|data/子宫特殊时期请暂停性生活|0|0|1346749072|1346749072|13
常洗鸳鸯浴的三大危害|data/常洗鸳鸯浴的三大危害|0|0|1346749072|1346749072|13
常跷二郎腿会影响男性生殖健康|data/常跷二郎腿会影响男性生殖健康|0|0|1346749072|1346749072|13
性交后下体骚痒一定要重视|data/性交后下体骚痒一定要重视|0|0|1346749072|1346749072|13
性交时抽筋我们如何应对?|data/性交时抽筋我们如何应对?|0|0|1346749072|1346749072|13
性爱中的六大甜蜜伤害怎么办?|data/性爱中的六大甜蜜伤害怎么办?|0|0|1346749072|1346749072|13
性爱前，哪些地方需要洗？|data/性爱前，哪些地方需要洗？|0|0|1346749072|1346749072|13
性爱时出现血精，怎么办?|data/性爱时出现血精，怎么办?|0|0|1346749072|1346749072|13
性生活的同时保护好你的阴道|data/性生活的同时保护好你的阴道|0|0|1346749072|1346749072|13
性生活过后别用湿巾清洁|data/性生活过后别用湿巾清洁|0|0|1346749072|1346749072|13
性生活雷人危险Top8|data/性生活雷人危险Top8|0|0|1346749072|1346749072|13
打哈欠和伸懒腰对性爱有好处|data/打哈欠和伸懒腰对性爱有好处|0|0|1346749072|1346749072|13
打高尔夫能助“性”|data/打高尔夫能助“性”|0|0|1346749072|1346749072|13
新婚夫妇不宜喝可乐|data/新婚夫妇不宜喝可乐|0|0|1346749072|1346749072|13
新婚夫妻性爱预防哪些疾病?|data/新婚夫妻性爱预防哪些疾病?|0|0|1346749072|1346749072|13
最有益健康的七种性爱姿势|data/最有益健康的七种性爱姿势|0|0|1346749072|1346749072|13
有关性病的预防|data/有关性病的预防|0|0|1346749072|1346749072|13
爱爱时女方肚子疼痛的几大原因?|data/爱爱时女方肚子疼痛的几大原因?|0|0|1346749072|1346749072|13
瑜珈几个动作让你性欲大增|data/瑜珈几个动作让你性欲大增|0|0|1346749072|1346749072|13
男人做好保护JJ让它长久雄风的几种好习惯|data/男人做好保护JJ让它长久雄风的几种好习惯|0|0|1346749072|1346749072|13
男人做性保健从睡觉开始做锻炼|data/男人做性保健从睡觉开始做锻炼|0|0|1346749072|1346749072|13
男人该怎么清洗自己私处?|data/男人该怎么清洗自己私处?|0|0|1346749072|1346749072|13
男人踮脚尖小便可益肾强精|data/男人踮脚尖小便可益肾强精|0|0|1346749072|1346749072|13
男性患哪些性器官疾病不宜做爱?|data/男性患哪些性器官疾病不宜做爱?|0|0|1346749072|1346749072|13
白领们是如何糟蹋他们的乳房的?|data/白领们是如何糟蹋他们的乳房的?|0|0|1346749072|1346749072|13
确保无后顾之忧的准备6份性保险|data/确保无后顾之忧的准备6份性保险|0|0|1346749072|1346749072|13
确保无后顾之忧的准备6份性保险(下)|data/确保无后顾之忧的准备6份性保险(下)|0|0|1346749072|1346749072|13
约会时睾丸胀痛别担心|data/约会时睾丸胀痛别担心|0|0|1346749072|1346749072|13
脊柱穴位按摩可以激发性欲|data/脊柱穴位按摩可以激发性欲|0|0|1346749072|1346749072|13
让男女提高性欲的7项运动|data/让男女提高性欲的7项运动|0|0|1346749072|1346749072|13
记住干活前的一环“洗手”|data/记住干活前的一环“洗手”|0|0|1346749072|1346749072|13
趴着睡对性健康危害最大|data/趴着睡对性健康危害最大|0|0|1346749072|1346749072|13
锻炼阴茎的四种方法|data/锻炼阴茎的四种方法|0|0|1346749072|1346749072|13
阴道痉挛让阴茎无法拔出怎么办|data/阴道痉挛让阴茎无法拔出怎么办|0|0|1346749072|1346749072|13
不同类型乳房的爱抚技巧|data/不同类型乳房的爱抚技巧|0|0|1346749071|1346749071|20
卧室里的“SM”性运动|data/卧室里的“SM”性运动|0|0|1346749071|1346749071|20
后庭刺激对女性意味着什么?|data/后庭刺激对女性意味着什么?|0|0|1346749071|1346749071|20
多点刺激法让你的女人射精|data/多点刺激法让你的女人射精|0|0|1346749071|1346749071|20
女人该如何爱抚男人的阴茎?|data/女人该如何爱抚男人的阴茎?|0|0|1346749071|1346749071|20
女性各性感带爱抚技巧|data/女性各性感带爱抚技巧|0|0|1346749071|1346749071|20
女生用手让男人小弟弟喷射的基本步骤|data/女生用手让男人小弟弟喷射的基本步骤|0|0|1346749071|1346749071|20
性生活夫妻爱按摩顺序技巧|data/性生活夫妻爱按摩顺序技巧|0|0|1346749071|1346749071|20
手脚并用的爱抚|data/手脚并用的爱抚|0|0|1346749071|1346749071|20
步步为营让她饥渴难耐的前戏大法|data/步步为营让她饥渴难耐的前戏大法|0|0|1346749071|1346749071|20
激情性爱时必要的乳房爱抚技巧|data/激情性爱时必要的乳房爱抚技巧|0|0|1346749071|1346749071|20
爱抚女人阴蒂的技巧|data/爱抚女人阴蒂的技巧|0|0|1346749071|1346749071|20
爱抚她的乳房的性爱技巧|data/爱抚她的乳房的性爱技巧|0|0|1346749071|1346749071|20
爱抚男人阴茎的11招|data/爱抚男人阴茎的11招|0|0|1346749071|1346749071|20
用舌头吻遍男人的这些易燃点|data/用舌头吻遍男人的这些易燃点|0|0|1346749071|1346749071|20
给她温柔的爱就要懂得去爱抚她的阴毛|data/给她温柔的爱就要懂得去爱抚她的阴毛|0|0|1346749071|1346749071|20
销魂的床上爱抚技巧|data/销魂的床上爱抚技巧|0|0|1346749071|1346749071|20
阴茎插入之前的爱抚动作|data/阴茎插入之前的爱抚动作|0|0|1346749071|1346749071|20
阴茎说：这样的手技我最爱|data/阴茎说：这样的手技我最爱|0|0|1346749071|1346749071|20
不勃起时也能插入做爱|data/不勃起时也能插入做爱|0|0|1346749071|1346749071|23
控制射精 入门要领很重要|data/控制射精 入门要领很重要|0|0|1346749071|1346749071|23
插入她阴道的次数与频率多少才能征服她到高潮|data/插入她阴道的次数与频率多少才能征服她到高潮|0|0|1346749071|1346749071|23
插入妻子子宫的方法|data/插入妻子子宫的方法|0|0|1346749071|1346749071|23
阴道插入基本方法|data/阴道插入基本方法|0|0|1346749071|1346749071|23
阴道插入经典法则|data/阴道插入经典法则|0|0|1346749071|1346749071|23
如何掌握阴茎插入的最佳时机?|data/如何掌握阴茎插入的最佳时机?|0|0|1347444456|1347444456|23
5招快速启动她的性欲|data/5招快速启动她的性欲|0|0|1346749071|1346749071|18
8个调情小游戏|data/8个调情小游戏|0|0|1346749071|1346749071|18
五个调情方法把性欲勾起来|data/五个调情方法把性欲勾起来|0|0|1346749071|1346749071|18
善穿内裤 提升夫妻生活情趣|data/善穿内裤 提升夫妻生活情趣|0|0|1346749071|1346749071|18
四妙招 令女人突然想做爱|data/四妙招 令女人突然想做爱|0|0|1346749071|1346749071|18
夫妻必会的3个性游戏|data/夫妻必会的3个性游戏|0|0|1346749071|1346749071|18
女人8个细节最具诱惑：穿红衣 轻触锁骨|data/女人8个细节最具诱惑：穿红衣 轻触锁骨|0|0|1346749071|1346749071|18
女人十大经典风骚动作|data/女人十大经典风骚动作|0|0|1346749071|1346749071|18
女人性欲来时的4个小动作|data/女人性欲来时的4个小动作|0|0|1346749071|1346749071|18
女人挑起男人性欲的性暗示技巧|data/女人挑起男人性欲的性暗示技巧|0|0|1346749071|1346749071|18
